video_id,publishedAt,channelId,title,description,thumbnails.default.url,thumbnails.default.width,thumbnails.default.height,thumbnails.medium.url,thumbnails.medium.width,thumbnails.medium.height,thumbnails.high.url,thumbnails.high.width,thumbnails.high.height,channelTitle,liveBroadcastContent,,,
VLntClMD780,2019-02-18T11:51:04.000Z,UCyLDp0Q6c1zhRM_eMfZvaEw,"<U+0417><U+0430><U+0432><U+0442><U+0440><U+0430><U+043A> <U+0432> STARBUCKS ! / <U+0420><U+043E><U+043B><U+043B>-<U+0441><U+044D><U+043D><U+0434><U+0432><U+0438><U+0447>, <U+041F><U+0430><U+0440><U+0444><U+0435>, <U+0421><U+044B><U+0440><U+043D><U+0438><U+043A><U+0438>, <U+0426><U+0435><U+0437><U+0430><U+0440><U+044C> / <U+0412><U+044B> <U+041D><U+0415> <U+041F><U+041E><U+0412><U+0415><U+0420><U+0418><U+0422><U+0415>, <U+0441><U+043A><U+043E><U+043B><U+044C><U+043A><U+043E> <U+044D><U+0442><U+043E> <U+0441><U+0442><U+043E><U+0438><U+0442>",<U+041A><U+0443><U+0434><U+0430> <U+044F> <U+043B><U+0435><U+0447><U+0443> <U+0442><U+0443><U+0442>: http://instagram.com/niknayse Unusual Food#1: https://www.youtube.com/watch?v=MZzvGGHW5dE <U+0421><U+043B><U+0435><U+0434><U+0443><U+044E><U+0449><U+0435><U+0435> <U+0432><U+0438><U+0434><U+0435><U+043E>!,https://i.ytimg.com/vi/VLntClMD780/default.jpg,120,90,https://i.ytimg.com/vi/VLntClMD780/mqdefault.jpg,320,180,https://i.ytimg.com/vi/VLntClMD780/hqdefault.jpg,480,360,<U+041D><U+0438><U+043A><U+0438><U+0442><U+0430> <U+041F><U+0435><U+0442><U+0440><U+044F><U+0435><U+0432>,none,,,
uXb4uNyoqUU,2016-02-02T01:34:30.000Z,UC4xZXizv7SCrct1j4IIzMzQ,<U+0420><U+0430><U+0431><U+043E><U+0442><U+0430> <U+0432> Starbucks I <U+041C><U+043E><U+0439> <U+041E><U+043F><U+044B><U+0442>,<U+041F><U+0440><U+0438><U+0441><U+043E><U+0435><U+0434><U+0438><U+043D><U+044F><U+0435><U+043C><U+0441><U+044F> <U+043A> <U+0433><U+0440><U+0443><U+043F><U+043F><U+0435> <U+0432> <U+0412><U+041A> <U+2756> https://vk.com/anthonyulyofficial <U+21D2> Periscope <U+2756> anthonyuly <U+21D2> Twitter <U+2756> https://twitter.com/AnthonyUly <U+21D2> Instagram <U+2756>...,https://i.ytimg.com/vi/uXb4uNyoqUU/default.jpg,120,90,https://i.ytimg.com/vi/uXb4uNyoqUU/mqdefault.jpg,320,180,https://i.ytimg.com/vi/uXb4uNyoqUU/hqdefault.jpg,480,360,Anthony Uly,none,,,
orX-vFCzMqU,2017-12-02T19:05:29.000Z,UCe4vswOuXiQO1d2ziSQV3Rg,10 Chockerade fakta om STARBUCKS - Visste du detta?!?!....,PRENUMERERA! Hej fina du öppna mig :) Välkomna till ännu en ny 10 fakta om. I dagens video delar jag med mig av 10 fakta om STARBUCKS som ni troligtvis ...,https://i.ytimg.com/vi/orX-vFCzMqU/default.jpg,120,90,https://i.ytimg.com/vi/orX-vFCzMqU/mqdefault.jpg,320,180,https://i.ytimg.com/vi/orX-vFCzMqU/hqdefault.jpg,480,360,Lea Wallin,none,,,
EtyKVkblDmw,2019-03-07T22:00:00.000Z,UCA2D6F968ttFiK6AwcZVmmw,NEW Ariana Grande Starbucks Cloud Macchiato TASTE TEST | IS IT WORTH IT? | KoriMaria,"So I decided to give this new Cloud Macchiato a try! For those of you don't know, Ariana Grande and Starbuck collaborated on a drink and I am here today to ...",https://i.ytimg.com/vi/EtyKVkblDmw/default.jpg,120,90,https://i.ytimg.com/vi/EtyKVkblDmw/mqdefault.jpg,320,180,https://i.ytimg.com/vi/EtyKVkblDmw/hqdefault.jpg,480,360,Kori Maria,none,,,
qhN6HOJ3crU,2018-10-04T18:16:47.000Z,UCaID_co9-ahze1rBfeNFuuA,STARBUCKS MERMAID HALLOWEEN COSTUME DIY | Superholly,"Hey guys!! After almost 2 years I'm FINALLY doing another tutorial! It's October, and I felt inspired to dress up as a certain mermaid that I see almost every day ...",https://i.ytimg.com/vi/qhN6HOJ3crU/default.jpg,120,90,https://i.ytimg.com/vi/qhN6HOJ3crU/mqdefault.jpg,320,180,https://i.ytimg.com/vi/qhN6HOJ3crU/hqdefault.jpg,480,360,Superholly English,none,,,
SQ_NQblVDMY,2015-10-11T00:30:02.000Z,UCB0d0JLn1WcGYcwwZ87d2LA,DIY Starbucks Halloween Costume!,DIY Starbucks Halloween Costume!” LETS TRY TO GET THIS TO 300000 likes Watch My Last Video! <U+279C> https://www.youtube.com/watch?v=ogS7eS8jHJ4 IF ...,https://i.ytimg.com/vi/SQ_NQblVDMY/default.jpg,120,90,https://i.ytimg.com/vi/SQ_NQblVDMY/mqdefault.jpg,320,180,https://i.ytimg.com/vi/SQ_NQblVDMY/hqdefault.jpg,480,360,Rclbeauty101,none,,,
VC_8zjFuUEQ,2019-03-13T20:49:32.000Z,UC4KYGQj-Jl3daDRHDBSAf9A,New! Ariana Grande Starbucks Cloud Macchiato Taste Test | BOBO,https://www.instagram.com/may.bobo BOBO.,https://i.ytimg.com/vi/VC_8zjFuUEQ/default.jpg,120,90,https://i.ytimg.com/vi/VC_8zjFuUEQ/mqdefault.jpg,320,180,https://i.ytimg.com/vi/VC_8zjFuUEQ/hqdefault.jpg,480,360,BOBO,none,,,
sk4OJryXyfM,2019-01-14T12:23:41.000Z,UCWKIZSYyrRvVqewNWrfamig,Ð<U+1ED2> U<U+1ED0>NG Ð<U+1EAE>T NH<U+1EA4>T STARBUCKS CÓ NGON KHÔNG? WHAT IS THE BEST OF STARBUCKS DRINKS? HUONG WITCH,You are welcome babe~ <U+2665><U+2665><U+2665> <U+2665> Ð<U+1EEB>ng ng<U+1EA7>n ng<U+1EA1>i pm cho Witch / Connect with me: <U+25BB>Facebook : https://goo.gl/hfFKVM <U+25BB>Instagram: ...,https://i.ytimg.com/vi/sk4OJryXyfM/default.jpg,120,90,https://i.ytimg.com/vi/sk4OJryXyfM/mqdefault.jpg,320,180,https://i.ytimg.com/vi/sk4OJryXyfM/hqdefault.jpg,480,360,Huong Witch,none,,,
qZnge-xDI2o,2018-04-20T07:45:00.000Z,UCMtFAi84ehTSYSE9XoHefig,"Starbucks, You Kicked The Wrong People Out","There are countless reasons to be bothered by a Starbucks patron, none of which have to do with skin color. Subscribe To \The Late Show\"" Channel HERE: ...""",https://i.ytimg.com/vi/qZnge-xDI2o/default.jpg,120,90,https://i.ytimg.com/vi/qZnge-xDI2o/mqdefault.jpg,320,180,https://i.ytimg.com/vi/qZnge-xDI2o/hqdefault.jpg,480,360,The Late Show with Stephen Colbert,none,,,
WBmkmGZKfl4,2014-12-12T11:33:12.000Z,UCYBSaV5kXMCSlj0S4cnIThA,Three STARBUCKS gift card wins from the claw machine!,COOL!! Starbucks cups with gift cards in them!! This machine is Crystal's favorite claw machine! She loves her some Starbucks. Lets see if she can win a ...,https://i.ytimg.com/vi/WBmkmGZKfl4/default.jpg,120,90,https://i.ytimg.com/vi/WBmkmGZKfl4/mqdefault.jpg,320,180,https://i.ytimg.com/vi/WBmkmGZKfl4/hqdefault.jpg,480,360,Plush Time Wins,none,,,
aCPvwJyok3Y,2013-04-08T17:35:18.000Z,UCoiM1cfBh5CyfHORqZbXaEQ,Starbucks Coffee (LID) polymer clay tutorial /  Café de Starbucks de arcilla polimérica,VISITA MI TIENDA EN LINEA   Checa los DESCUENTOS Y PROMOCIONES   https://www.kichink.com/stores/elartedepau Suscríbete al canal EL ARTE DE ...,https://i.ytimg.com/vi/aCPvwJyok3Y/default.jpg,120,90,https://i.ytimg.com/vi/aCPvwJyok3Y/mqdefault.jpg,320,180,https://i.ytimg.com/vi/aCPvwJyok3Y/hqdefault.jpg,480,360,El Arte de PAU,none,,,
5MmlhVbB9oM,2018-11-02T14:39:05.000Z,UCj4nCgtjKJppK_IZeY8TUJg,Starbucks Holiday 2018 | Peppermint Mocha,Feel the excitement of the holiday season. Sip a cup of magic with Starbucks Peppermint Mocha. Available for a limited time.,https://i.ytimg.com/vi/5MmlhVbB9oM/default.jpg,120,90,https://i.ytimg.com/vi/5MmlhVbB9oM/mqdefault.jpg,320,180,https://i.ytimg.com/vi/5MmlhVbB9oM/hqdefault.jpg,480,360,Starbucks Coffee,none,,,
Od-xU2N_Bb4,2018-08-03T13:00:04.000Z,UCJ_p77viFKs3MHz8fb55Now,GÖZÜ KAPALI STARBUCKS KAHVE TESTI!,"Merhabalar! Bu videoda, GÖZÜ KAPALI STARBUCKS KAHVE TESTI! yaptik. Siz de Starbucks kahvelerini merak ediyorsaniz, GÖZÜ KAPALI STARBUCKS ...",https://i.ytimg.com/vi/Od-xU2N_Bb4/default.jpg,120,90,https://i.ytimg.com/vi/Od-xU2N_Bb4/mqdefault.jpg,320,180,https://i.ytimg.com/vi/Od-xU2N_Bb4/hqdefault.jpg,480,360,SOSYOSELF,none,,,
h0TRpGP8yH4,2014-07-30T03:00:01.000Z,UCUsN5ZwHx2kILm84-jPDeXw,Nathan For You - Dumb Starbucks - Open for Business,Nathan finds himself at the center of an international sensation after the media catches wind of his parody coffee shop. The Comedy Central app has full ...,https://i.ytimg.com/vi/h0TRpGP8yH4/default.jpg,120,90,https://i.ytimg.com/vi/h0TRpGP8yH4/mqdefault.jpg,320,180,https://i.ytimg.com/vi/h0TRpGP8yH4/hqdefault.jpg,480,360,Comedy Central,none,,,
Xqo3uTEGRfY,2019-03-12T23:47:30.000Z,UC4H2NI8o0kx_yi2RqS7Zs1g,Drive with me to Starbucks! + Q&amp;A,Hey guys! Welcome back to my channel! I wanted to answer some questions! I hope you enjoyed the video and I'll see you guys next time! Byyeee!,https://i.ytimg.com/vi/Xqo3uTEGRfY/default.jpg,120,90,https://i.ytimg.com/vi/Xqo3uTEGRfY/mqdefault.jpg,320,180,https://i.ytimg.com/vi/Xqo3uTEGRfY/hqdefault.jpg,480,360,Destiny Arispe,none,,,
W0gEtNbfHjA,2017-08-26T21:00:03.000Z,UC_hSjGOO67A6gIDUcyuv_8A,"new mini starbucks drink, only $4.50","new mini starbucks drink, only $4.50. These mini star bucks and mini stuff is SO FUNNY TO SEE! If you guys want a part 3, Let's get 50000 likes! GET MY NEW ...",https://i.ytimg.com/vi/W0gEtNbfHjA/default.jpg,120,90,https://i.ytimg.com/vi/W0gEtNbfHjA/mqdefault.jpg,320,180,https://i.ytimg.com/vi/W0gEtNbfHjA/hqdefault.jpg,480,360,Infinite,none,,,
aH4dYgHOAJQ,2018-09-27T11:45:00.000Z,UCKjjmMqvuxNYw8c6knceexQ,COFFEE MAKER TOY!!! Kids Starbucks Style Chocolate Latte Maker Kids Toys,Kids Coffee Maker Toy that whips and froths milk into yummy shakes and smoothies. This Creative Cafe Barista Bar playset comes with chocolate and ...,https://i.ytimg.com/vi/aH4dYgHOAJQ/default.jpg,120,90,https://i.ytimg.com/vi/aH4dYgHOAJQ/mqdefault.jpg,320,180,https://i.ytimg.com/vi/aH4dYgHOAJQ/hqdefault.jpg,480,360,Sandaroo Kids [DisneyCarToys],none,,,
GfJPmmCDA_4,2018-04-03T06:02:38.000Z,UCYzkb8WCMF0av77kjC6DCXw,<U+0416><U+0435><U+0440><U+0442><U+0432><U+0430> <U+043C><U+0430><U+0440><U+043A><U+0435><U+0442><U+0438><U+043D><U+0433><U+0430> 2.0 | <U+041D><U+0430><U+043F><U+0438><U+0442><U+043A><U+0438> <U+043E><U+0442> STARBUCKS,<U+041D><U+0430><U+043F><U+0438><U+0442><U+043A><U+0438>! ---------------- <U+0418><U+043D><U+0442><U+0435><U+0440><U+0435><U+0441><U+043D><U+044B><U+0435> <U+0441><U+0441><U+044B><U+043B><U+043A><U+0438>: 1<U+FE0F><U+20E3> <U+041F><U+043E> <U+0440><U+0435><U+043A><U+043B><U+0430><U+043C><U+0435> http://goo.gl/fGdH36 2<U+FE0F><U+20E3> <U+041E><U+0444><U+0438><U+0446><U+0438><U+0430><U+043B><U+044C><U+043D><U+044B><U+0439> <U+0441><U+0430><U+0439><U+0442> http://goo.gl/z1r4Wh 3<U+FE0F><U+20E3> <U+041B><U+0430><U+0439><U+0444>-...,https://i.ytimg.com/vi/GfJPmmCDA_4/default.jpg,120,90,https://i.ytimg.com/vi/GfJPmmCDA_4/mqdefault.jpg,320,180,https://i.ytimg.com/vi/GfJPmmCDA_4/hqdefault.jpg,480,360,<U+041F><U+043E><U+043A><U+0430><U+0448><U+0435><U+0432><U+0430><U+0440><U+0438><U+043C>,none,,,
A_n88E99Hdk,2018-06-07T22:00:01.000Z,UC2w1CQqPli4w94-PCg2UvJQ,Starbucks Racism,"Maybe a bit cheesy, but \Starbucks Racism\"" and \""Starbucks Racists\"" IMO quickly conveys the concept. Starbucks training video: ...""",https://i.ytimg.com/vi/A_n88E99Hdk/default.jpg,120,90,https://i.ytimg.com/vi/A_n88E99Hdk/mqdefault.jpg,320,180,https://i.ytimg.com/vi/A_n88E99Hdk/hqdefault.jpg,480,360,The Alternative Hypothesis,none,,,
7y8zVmpcS8A,2014-10-29T04:21:47.000Z,UCljy6_3EPeAybTZ6huAnyjw,"Die Anstalt: TTIP, Steueroasen, Starbucks, Amazon, Apple und NSA/BND","Die Anstalt vom 28.Oktober 2014 zu: TTIP, Steueroasen, Starbucks- Starbucketchallenge  , Amazon - Jean-Claude Juncker, Apple, NSA/BND zu Gast: Michael ...",https://i.ytimg.com/vi/7y8zVmpcS8A/default.jpg,120,90,https://i.ytimg.com/vi/7y8zVmpcS8A/mqdefault.jpg,320,180,https://i.ytimg.com/vi/7y8zVmpcS8A/hqdefault.jpg,480,360,uncutnews.ch,none,,,
42UcR8ztbYE,2019-03-12T14:00:00.000Z,UCz34gwGT0XQh8D5CgOWb9mQ,Drawing APEX LEGENDS - on a STARBUCKS CUP???,"In this video I draw characters from the game APEX LEGENDS on a STARBUCKS CUP! For Prints, Comics, Commissions and Original Artwork by James Raiz, ...",https://i.ytimg.com/vi/42UcR8ztbYE/default.jpg,120,90,https://i.ytimg.com/vi/42UcR8ztbYE/mqdefault.jpg,320,180,https://i.ytimg.com/vi/42UcR8ztbYE/hqdefault.jpg,480,360,TheBoxOfficeArtist,none,,,
H3Ea7LzhM8E,2017-03-10T14:19:59.000Z,UCnq1w-56tAvMdDup-CL6Vtg,Homemade Starbucks Breakfast Recipes - Meal Prepping Ideas,I'm making the most popular starbucks recipes for breakfast for meal prepping. This starbucks recipe is way cheaper to make at home and great meal prepping ...,https://i.ytimg.com/vi/H3Ea7LzhM8E/default.jpg,120,90,https://i.ytimg.com/vi/H3Ea7LzhM8E/mqdefault.jpg,320,180,https://i.ytimg.com/vi/H3Ea7LzhM8E/hqdefault.jpg,480,360,FlavCity with Bobby Parrish,none,,,
sBKL9752NWw,2017-12-05T18:18:31.000Z,UCvJJ_dzjViJCoLf5uKUTwoA,Former Starbucks CEO Howard Schultz &amp; Alibaba Founder Jack Ma On Starbucks In China | CNBC,CNBC's Andrew Ross Sorkin sits down with Alibaba founder Jack Ma and former Starbucks CEO Howard Schultz in an interview from Shanghai's new Starbucks ...,https://i.ytimg.com/vi/sBKL9752NWw/default.jpg,120,90,https://i.ytimg.com/vi/sBKL9752NWw/mqdefault.jpg,320,180,https://i.ytimg.com/vi/sBKL9752NWw/hqdefault.jpg,480,360,CNBC,none,,,
POyYueJx5ZI,2019-03-10T16:13:42.000Z,UC4-S2mJ8bCgbK53PM-_qQWg,Working at Starbucks | *Updated*,"Working at Starbucks: https://youtu.be/noDlv6dz8UA - - - For those of you who new to my channel - - - READ ME - - - Welcome to my channel, my name is Rachel ...",https://i.ytimg.com/vi/POyYueJx5ZI/default.jpg,120,90,https://i.ytimg.com/vi/POyYueJx5ZI/mqdefault.jpg,320,180,https://i.ytimg.com/vi/POyYueJx5ZI/hqdefault.jpg,480,360,Rachel Schumacher,none,,,
Y4KrdjAPohc,2014-07-30T03:00:01.000Z,UCUsN5ZwHx2kILm84-jPDeXw,Nathan For You - Dumb Starbucks - Legal Advice,"After pitching his idea to turn a struggling cafe into the world's first parody coffee shop, Nathan consults a lawyer to make sure that the concept is legally sound.",https://i.ytimg.com/vi/Y4KrdjAPohc/default.jpg,120,90,https://i.ytimg.com/vi/Y4KrdjAPohc/mqdefault.jpg,320,180,https://i.ytimg.com/vi/Y4KrdjAPohc/hqdefault.jpg,480,360,Comedy Central,none,,,
BzrBcRaBy18,2019-03-12T10:23:42.000Z,UCT50TWqh-Z5eo6DKJSabOMA,Mercado de Cripto! 12/03 420 DIAS DE QUEDA! / Starbucks / Sinais BitNada,Mercado de Cripto! seu jornal diário sobre Bitcoin (BTC) e Criptomoedas! Sinais - https://bitnada.com.br/sinais/ Starbucks e Desafios ...,https://i.ytimg.com/vi/BzrBcRaBy18/default.jpg,120,90,https://i.ytimg.com/vi/BzrBcRaBy18/mqdefault.jpg,320,180,https://i.ytimg.com/vi/BzrBcRaBy18/hqdefault.jpg,480,360,BitNada,none,,,
97_fqt_iw1o,2018-09-09T22:11:52.000Z,UCzrZ-VYdMa9dPkpA6nf92WA,STARBUCKS A MILANO! SELVAGGIA LUCARELLI SI SBAGLIA: ecco perché è un&#39;idea MERAVIGLIOSA (ASMR vlog),Sono stata il 6 settembre all'evento di pre apertura di Starbucks a Milano e ho trascorso nella roastery anche i giorni successivi per studiare al 100% il concept.,https://i.ytimg.com/vi/97_fqt_iw1o/default.jpg,120,90,https://i.ytimg.com/vi/97_fqt_iw1o/mqdefault.jpg,320,180,https://i.ytimg.com/vi/97_fqt_iw1o/hqdefault.jpg,480,360,Fairy Asmr,none,,,
apFc0r2sDwk,2017-04-21T15:16:06.000Z,UC3dEvA1is6-0_yuei9iCdEw,How to Draw a Starbucks Unicorn Frappuccino,"Learn how to draw a Starbucks Unicorn Frappuccino step by step cute. Follow along, easy art lesson for kids of all ages. Enjoy this sweet magical drink!",https://i.ytimg.com/vi/apFc0r2sDwk/default.jpg,120,90,https://i.ytimg.com/vi/apFc0r2sDwk/mqdefault.jpg,320,180,https://i.ytimg.com/vi/apFc0r2sDwk/hqdefault.jpg,480,360,Draw So Cute,none,,,
YubYxXdyHzE,2012-09-30T06:49:27.000Z,UCOU9zw-zdE50JqnxyQRYiTw,HOW TO MAKE A STARBUCKS ICED CARAMEL MACCHIATO LATTE,UPDATED VIDEO - https://youtu.be/z4Wda6JyE0k Gaggia Classic Espresso Machine - https://amzn.to/2U0y9AF Starbucks Reuseable Plastic Cup ...,https://i.ytimg.com/vi/YubYxXdyHzE/default.jpg,120,90,https://i.ytimg.com/vi/YubYxXdyHzE/mqdefault.jpg,320,180,https://i.ytimg.com/vi/YubYxXdyHzE/hqdefault.jpg,480,360,pinkmacprincess,none,,,
erzgOS8mctI,2018-09-12T21:15:59.000Z,UCj4nCgtjKJppK_IZeY8TUJg,Starbucks Coffee Craft - The Art of Cold Foam Cold Brew,"In each extraordinary cup, you'll find our passion for coffee craft. Like in the Cold Foam Cold Brew, where slow-steeped cold brew gets crowned with velvety cold ...",https://i.ytimg.com/vi/erzgOS8mctI/default.jpg,120,90,https://i.ytimg.com/vi/erzgOS8mctI/mqdefault.jpg,320,180,https://i.ytimg.com/vi/erzgOS8mctI/hqdefault.jpg,480,360,Starbucks Coffee,none,,,
JB-nlXm6u6w,2019-03-08T14:00:03.000Z,UCQvtaQk-YLQ6c37wYhTADLw,Trying the new Ariana Grande Starbucks drunk!! [iced caramel cloud macchiato] | AJ Colding,Lit or Sh*t Trying Ari's new Starbucks drink. YUH! Social media: FB: AJ Colding IG: @ajcolding SC: Ajcolding.,https://i.ytimg.com/vi/JB-nlXm6u6w/default.jpg,120,90,https://i.ytimg.com/vi/JB-nlXm6u6w/mqdefault.jpg,320,180,https://i.ytimg.com/vi/JB-nlXm6u6w/hqdefault.jpg,480,360,AJColding,none,,,
1nCM1apDNoY,2017-02-19T19:04:26.000Z,UCey_c7U86mJGz1VJWH5CYPA,Most Expensive Thing at Starbucks?!,Thanks for watching! Don't forget to subscribe for more videos! <U+25BB> SUBSCRIBE FOR MORE VIDEOS: ...,https://i.ytimg.com/vi/1nCM1apDNoY/default.jpg,120,90,https://i.ytimg.com/vi/1nCM1apDNoY/mqdefault.jpg,320,180,https://i.ytimg.com/vi/1nCM1apDNoY/hqdefault.jpg,480,360,iJustine,none,,,
HbNYuOTaYFs,2018-01-17T22:33:30.000Z,UCVYamHliCI9rw1tHR1xbkfw,I Bought The $80 Starbucks Mug...,Dave2D review of the Ember ceramic mug sold at Starbucks. Ember Ceramic Mug - http://amzn.to/2DnG1qR If you're looking to keep your drinks warm all day ...,https://i.ytimg.com/vi/HbNYuOTaYFs/default.jpg,120,90,https://i.ytimg.com/vi/HbNYuOTaYFs/mqdefault.jpg,320,180,https://i.ytimg.com/vi/HbNYuOTaYFs/hqdefault.jpg,480,360,Dave Lee,none,,,
rL6eKdVtzSM,2016-05-16T22:17:16.000Z,UCJVkkxqSzMZDcLFhULXAIIQ,Trying Starbucks Secret Menu Frappuccinos You NEED To Try!,"TODAY WE TRY THE STARBUCKS SECRET MENU! We picked up Butter Beer, Snickers, Birthday Cake, Red Velvelt, Captain Crunch and Apple Pie ...",https://i.ytimg.com/vi/rL6eKdVtzSM/default.jpg,120,90,https://i.ytimg.com/vi/rL6eKdVtzSM/mqdefault.jpg,320,180,https://i.ytimg.com/vi/rL6eKdVtzSM/hqdefault.jpg,480,360,Dan and Riya,none,,,
pfG7MLiolP0,2016-09-20T21:04:30.000Z,UChODxRLggLqe3OikwUzt4Qw,DIY American Girl Doll Starbucks Frappe,Learn how to make American Girl Doll Starbucks Frappe. This simple doll craft is fun and easy to make. We love making Doll Starbucks Frappe Crafts and hope ...,https://i.ytimg.com/vi/pfG7MLiolP0/default.jpg,120,90,https://i.ytimg.com/vi/pfG7MLiolP0/mqdefault.jpg,320,180,https://i.ytimg.com/vi/pfG7MLiolP0/hqdefault.jpg,480,360,American Girl Ideas,none,,,
If27WEexVDM,2016-11-03T02:03:28.000Z,UCPcFg7aBbaVzXoIKSNqwaww,THE STARBUCKS NAME GAME (JackAsk #73),Previous JackAsk: https://www.youtube.com/watch?v=eQcHnToHwAI&index=1&list=PLiWL8lZPZ2_lu7N97HjRXqGV_eHEiS5F7 Subscribe ...,https://i.ytimg.com/vi/If27WEexVDM/default.jpg,120,90,https://i.ytimg.com/vi/If27WEexVDM/mqdefault.jpg,320,180,https://i.ytimg.com/vi/If27WEexVDM/hqdefault.jpg,480,360,jacksfilms,none,,,
wMAvx-VZm10,2016-01-16T21:38:32.000Z,UC0qjcilrxtf1HSVh3wlXfrA,Stealing From Starbucks *REACTION*,Waterbug of the week: Will be announced in Wednesday's video!! ------------------------------- Subscribe: https://goo.gl/y5ALcZ ------------------------------- Contouring My ...,https://i.ytimg.com/vi/wMAvx-VZm10/default.jpg,120,90,https://i.ytimg.com/vi/wMAvx-VZm10/mqdefault.jpg,320,180,https://i.ytimg.com/vi/wMAvx-VZm10/hqdefault.jpg,480,360,Alx James,none,,,
DD6IVewTVY8,2018-07-23T18:17:34.000Z,UCsr6Q8SI7Pvck0PIWN6-WVA,Can You Use STARBUCKS Coffee as ENGINE OIL?,Follow us on instagram : @od_orion @hsa_chai @takeovernw Lambo : https://www.smygovexotics.com/loans.,https://i.ytimg.com/vi/DD6IVewTVY8/default.jpg,120,90,https://i.ytimg.com/vi/DD6IVewTVY8/mqdefault.jpg,320,180,https://i.ytimg.com/vi/DD6IVewTVY8/hqdefault.jpg,480,360,Life OD,none,,,
XnEBixTe4ZI,2012-06-14T23:37:59.000Z,UCj4nCgtjKJppK_IZeY8TUJg,What It&#39;s Like to be a Starbucks Partner,"At Starbucks it all comes together. Connect with something bigger, have an impact every day, and work someplace truly great. The opportunity is here -- all you ...",https://i.ytimg.com/vi/XnEBixTe4ZI/default.jpg,120,90,https://i.ytimg.com/vi/XnEBixTe4ZI/mqdefault.jpg,320,180,https://i.ytimg.com/vi/XnEBixTe4ZI/hqdefault.jpg,480,360,Starbucks Coffee,none,,,
V_x5MlyGjz0,2017-04-22T23:28:13.000Z,UCBMxQPhfM6nkhQ8vPfQhkCg,"DIY Unicorn Frappuccino, Corinne VS Starbucks #3","Ugh. Yes, us too. Subscribe: http://www.bit.ly/12rVBFV Find us else where on the World Wide Webs: snapchat: corinneleighz ...",https://i.ytimg.com/vi/V_x5MlyGjz0/default.jpg,120,90,https://i.ytimg.com/vi/V_x5MlyGjz0/mqdefault.jpg,320,180,https://i.ytimg.com/vi/V_x5MlyGjz0/hqdefault.jpg,480,360,ThreadBanger,none,,,
CBm7Ata6Q_Q,2013-06-11T10:07:12.000Z,UCjPpYk0XPwGGUwGMBgbH_Eg,Starbucks Coffee Perfection,"For Starbucks we made this video telling the reversed story from coffee bean to coffee cup. Client: Starbucks Coffee Asia Pacific Ltd. Creative direction, ...",https://i.ytimg.com/vi/CBm7Ata6Q_Q/default.jpg,120,90,https://i.ytimg.com/vi/CBm7Ata6Q_Q/mqdefault.jpg,320,180,https://i.ytimg.com/vi/CBm7Ata6Q_Q/hqdefault.jpg,480,360,rogierwieland,none,,,
xFfA6gxUIO0,2017-05-20T16:43:33.000Z,UCH8NnRkxQg1zX7mHFRPq73g,Unicorn Milkshake | Homemade DIY Starbucks Unicorn Frappuccino by So Yummy,"Milkshakes can be FUN!, Learn how to make this Easy DIY Unicorn Milkshake at home with this super easy video, For more Fun Recipes Click here: ...",https://i.ytimg.com/vi/xFfA6gxUIO0/default.jpg,120,90,https://i.ytimg.com/vi/xFfA6gxUIO0/mqdefault.jpg,320,180,https://i.ytimg.com/vi/xFfA6gxUIO0/hqdefault.jpg,480,360,So Yummy,none,,,
9HVMhm59Ibs,2012-04-03T22:47:38.000Z,UCrviDVE31zPzDyM9sS5ZzYQ,Starbucks Marketing,"Starbucks marketing Video by Travis, James, and Leighton.",https://i.ytimg.com/vi/9HVMhm59Ibs/default.jpg,120,90,https://i.ytimg.com/vi/9HVMhm59Ibs/mqdefault.jpg,320,180,https://i.ytimg.com/vi/9HVMhm59Ibs/hqdefault.jpg,480,360,James Molnar,none,,,
4r9EFK2Qxo0,2012-08-24T12:17:26.000Z,UCQpwDEZenMK6rzhLqCZXRhw,Frappucchino de Mocha al Estilo Starbucks,"Frappe Cappuccino de mocha. Nuestra Receta Copycat de Starbucks Mocha Frappuccino. La palabra frappuccino es la unión frappé (hielo) y cappuccino, ...",https://i.ytimg.com/vi/4r9EFK2Qxo0/default.jpg,120,90,https://i.ytimg.com/vi/4r9EFK2Qxo0/mqdefault.jpg,320,180,https://i.ytimg.com/vi/4r9EFK2Qxo0/hqdefault.jpg,480,360,En Casa Contigo,none,,,
YKqK-Xi1Em8,2019-03-10T19:13:48.000Z,UCOU9zw-zdE50JqnxyQRYiTw,HOW TO MAKE A CINNAMON CLOUD MACCHIATO | NEW STARBUCKS ICE DRINK MENU,EGG WHITE POWDER - https://amzn.to/2J8jy5l LEMON SYRUP - https://amzn.to/2Cgk3V0 CINNAMON SYRUP - https://amzn.to/2F0QlVu HAND FROTHER ...,https://i.ytimg.com/vi/YKqK-Xi1Em8/default.jpg,120,90,https://i.ytimg.com/vi/YKqK-Xi1Em8/mqdefault.jpg,320,180,https://i.ytimg.com/vi/YKqK-Xi1Em8/hqdefault.jpg,480,360,pinkmacprincess,none,,,
SzNG--d0fdc,2015-08-29T13:30:01.000Z,UCg-YSRB6TsIq-c5PUZ0F1Jg,"Make a Starbucks Frappuccino / Cotton Candy Frappuccino, Java Chip Frappuccino &amp; Caramel Frappuccino","More Homemade Starbucks Drinks: https://youtu.be/kftHpe3OsvY?list=PL7F9HNhSDxR3PYdjRcD6ZYsJG2S29Ac70 Stephanie is back again, and this time ...",https://i.ytimg.com/vi/SzNG--d0fdc/default.jpg,120,90,https://i.ytimg.com/vi/SzNG--d0fdc/mqdefault.jpg,320,180,https://i.ytimg.com/vi/SzNG--d0fdc/hqdefault.jpg,480,360,Cookies Cupcakes and Cardio,none,,,
dvjGoauiycE,2018-09-25T21:09:46.000Z,UCj4nCgtjKJppK_IZeY8TUJg,Starbucks At Home Coffee - Brian,"Starbucks Barista Brian takes his passion for coffee home with him. Literally. Try Starbucks At Home Coffee, Single Origin Sumatra available in stores now.",https://i.ytimg.com/vi/dvjGoauiycE/default.jpg,120,90,https://i.ytimg.com/vi/dvjGoauiycE/mqdefault.jpg,320,180,https://i.ytimg.com/vi/dvjGoauiycE/hqdefault.jpg,480,360,Starbucks Coffee,none,,,
_rHsM9Y5WNs,2017-12-02T21:45:21.000Z,UCYX4G8yaNol461gtppjEfpQ,JA¨MFO¨R STARBUCKS &amp; ESPRESSO HOUSE,SEN VIDEO IM SO SORRY.,https://i.ytimg.com/vi/_rHsM9Y5WNs/default.jpg,120,90,https://i.ytimg.com/vi/_rHsM9Y5WNs/mqdefault.jpg,320,180,https://i.ytimg.com/vi/_rHsM9Y5WNs/hqdefault.jpg,480,360,Jessica Pamlin,none,,,
5cuudl8ugj0,2019-03-14T18:38:15.000Z,UCK5_g1A9NvNe8Zy2PCK46cQ,(Suicidio en Starbucks) La cancion ARTIFICIAL de katy winter antes de suicidarse,"\I don't want to say goodbye\"" es la canción póstuma de la adolescente Katy Winter"," quien se suicidó en 2018 tras un fuerte cyberacoso de sus compañeros de ...""",https://i.ytimg.com/vi/5cuudl8ugj0/default.jpg,120,90,https://i.ytimg.com/vi/5cuudl8ugj0/mqdefault.jpg,320,180,https://i.ytimg.com/vi/5cuudl8ugj0/hqdefault.jpg,480,360,aca videos,none,,
1JZ_m4YXomw,2015-10-10T08:40:45.000Z,UC_FNd7A9b0adbxmpuzIm5ZA,How To Make Giant Starbucks Cup - DIY Starbucks Storage Bucket (StarBuckET),This is a video tutorial of DIY Giant Starbucks Cup - absolutely adorable storage bucket (or as I call it - StarbuckET). This Starbucks bucket is really easy to make ...,https://i.ytimg.com/vi/1JZ_m4YXomw/default.jpg,120,90,https://i.ytimg.com/vi/1JZ_m4YXomw/mqdefault.jpg,320,180,https://i.ytimg.com/vi/1JZ_m4YXomw/hqdefault.jpg,480,360,IdunnGoddess,none,,,
NDqAp3HBYRQ,2018-11-25T00:16:51.000Z,UCyG_mUXBIWaoLkuiRnAWDvA,Starbucks is Fast Food!? | Pop Culture TRIVIA,Do you think Starbucks is Fast Food? #popculture #trivia Subscribe <U+279C> http://bit.ly/JoinJKPFam Game Rules <U+265F> https://igottagowith.com/pages/game-directions ...,https://i.ytimg.com/vi/NDqAp3HBYRQ/default.jpg,120,90,https://i.ytimg.com/vi/NDqAp3HBYRQ/mqdefault.jpg,320,180,https://i.ytimg.com/vi/NDqAp3HBYRQ/hqdefault.jpg,480,360,JustKiddingParty,none,,,
QXRFq7e8f54,2018-04-16T15:23:44.000Z,UCeH6qE4V7n5tVwP7NkdrtJg,Outcry Over Arrests At Starbucks? | The View,,https://i.ytimg.com/vi/QXRFq7e8f54/default.jpg,120,90,https://i.ytimg.com/vi/QXRFq7e8f54/mqdefault.jpg,320,180,https://i.ytimg.com/vi/QXRFq7e8f54/hqdefault.jpg,480,360,The View,none,,,
5t30cC2payc,2015-06-12T07:30:00.000Z,UCa6vGFO9ty8v5KZJXQxdhaw,"Tyler, The Creator Worked at Starbucks",Tyler recalls his intense dislike for the woman who fired him from Starbucks. SUBSCRIBE to get the latest #KIMMEL: http://bit.ly/JKLSubscribe Watch the latest ...,https://i.ytimg.com/vi/5t30cC2payc/default.jpg,120,90,https://i.ytimg.com/vi/5t30cC2payc/mqdefault.jpg,320,180,https://i.ytimg.com/vi/5t30cC2payc/hqdefault.jpg,480,360,Jimmy Kimmel Live,none,,,
