video_id,publishedAt,channelId,title,description,thumbnails.default.url,thumbnails.default.width,thumbnails.default.height,thumbnails.medium.url,thumbnails.medium.width,thumbnails.medium.height,thumbnails.high.url,thumbnails.high.width,thumbnails.high.height,channelTitle,liveBroadcastContent,,,
jf0ZtZ8CVkk,2019-03-08T17:00:09.000Z,UCwiTOchWeKjrJZw7S1H__1g,Inside Italy’s Only Starbucks,"The Milan Roastery is one of only five Starbucks Reserve Roasteries in the world, and it is the only roastery in Europe. It was labelled by the company itself as ...",https://i.ytimg.com/vi/jf0ZtZ8CVkk/default.jpg,120,90,https://i.ytimg.com/vi/jf0ZtZ8CVkk/mqdefault.jpg,320,180,https://i.ytimg.com/vi/jf0ZtZ8CVkk/hqdefault.jpg,480,360,FOOD INSIDER,none,,,
XUBeH7VQaFY,2019-01-10T17:00:03.000Z,UCvJJ_dzjViJCoLf5uKUTwoA,How Starbucks Became An $80B Business,"In its 47-year history, Starbucks has transformed from a single coffee bean store in Seattle to a 30000 cafe international coffee power house. But massive ...",https://i.ytimg.com/vi/XUBeH7VQaFY/default.jpg,120,90,https://i.ytimg.com/vi/XUBeH7VQaFY/mqdefault.jpg,320,180,https://i.ytimg.com/vi/XUBeH7VQaFY/hqdefault.jpg,480,360,CNBC,none,,,
XX6fhw2mltE,2018-01-31T12:30:00.000Z,UCHs3bWyXIw_6J0ORvg97b2w,Starbucks <U+2615> Coffee Cafe Success Story In Hindi | Howard Schultz Biography | Coffee Cafe,"This video is about starbucks coffee cafe success story in hindi, Starbucks Corporation is an American coffee company and coffeehouse chain. Starbucks was ...",https://i.ytimg.com/vi/XX6fhw2mltE/default.jpg,120,90,https://i.ytimg.com/vi/XX6fhw2mltE/mqdefault.jpg,320,180,https://i.ytimg.com/vi/XX6fhw2mltE/hqdefault.jpg,480,360,Live Hindi,none,,,CNBC
GGc3hayrQwY,2018-01-12T23:00:00.000Z,UCk-9HZxQqKJLkj_GtFV3XbA,"I Drink EVERYTHING On The STARBUCKS Menu (25,000 CALORIES!!) <U+2615><U+FE0F><U+0001F964> | Mar",Subscribe! http://goo.gl/rYith7 <U+2665><U+2665><U+2665> Check out my other channels: Cool videos in spanish: http://goo.gl/8YPna6 Personal videos in spanish: ...,https://i.ytimg.com/vi/GGc3hayrQwY/default.jpg,120,90,https://i.ytimg.com/vi/GGc3hayrQwY/mqdefault.jpg,320,180,https://i.ytimg.com/vi/GGc3hayrQwY/hqdefault.jpg,480,360,Mar <U+2665>,none,,,FOOD Insider
5KfBYjSYP5Q,2018-03-24T06:47:21.000Z,UCfNtN-6y6vLXfPl9Cxa4LaA,"Kolkata&#39;s First Starbucks ||  Everything You Need to Know! Honest Review, Taste Test and more!",Hey Guys!! So Starbucks is finally in Kolkata and we all are happy about it! This video is a complete guide which covers detail tour of all the three locations and I ...,https://i.ytimg.com/vi/5KfBYjSYP5Q/default.jpg,120,90,https://i.ytimg.com/vi/5KfBYjSYP5Q/mqdefault.jpg,320,180,https://i.ytimg.com/vi/5KfBYjSYP5Q/hqdefault.jpg,480,360,ShinewithShanu,none,,,BBC
FQDyYJOQPng,2019-03-10T19:01:56.000Z,UCl_XHgj9EgR540XGTL0RkrA,TESTING STARBUCKS SECRET MENU HACKS &amp; ARIANA CLOUD MACCHIATO,Can you IMAGINE the thoughts IN MY HEAD when I saw that Ariana Grande was partnering with Sbux on the Cloud Macchiato? But was it a BAD IDEA?! Did we ...,https://i.ytimg.com/vi/FQDyYJOQPng/default.jpg,120,90,https://i.ytimg.com/vi/FQDyYJOQPng/mqdefault.jpg,320,180,https://i.ytimg.com/vi/FQDyYJOQPng/hqdefault.jpg,480,360,Erin Robinson,none,,,CBS This Morning
hQptepGEdA4,2017-10-04T17:49:28.000Z,UC56D-IHcUvLVFTX_8NpQMXg,Tasting the WEIRDEST Starbucks&#39; SECRET MENU DRINKS!! | Brent Rivera,"Tasting the WEIRDEST Starbucks' SECRET MENU DRINKS!! | Brent Rivera Give this video a THUMBS UP if you want to try one of these drinks! AND, If you're ...",https://i.ytimg.com/vi/hQptepGEdA4/default.jpg,120,90,https://i.ytimg.com/vi/hQptepGEdA4/mqdefault.jpg,320,180,https://i.ytimg.com/vi/hQptepGEdA4/hqdefault.jpg,480,360,MrBrent98,none,,,TheEllenShow
IQ4hGFWZ7vM,2017-08-01T10:00:15.000Z,UCu4AP8qmYnXNUipUeyPQKig,Ordering Coffee at Starbucks | English Class,In this English class we look at the English you need when ordering coffee at Starbucks. I'll teach you the useful expressions and vocabulary to give you the ...,https://i.ytimg.com/vi/IQ4hGFWZ7vM/default.jpg,120,90,https://i.ytimg.com/vi/IQ4hGFWZ7vM/mqdefault.jpg,320,180,https://i.ytimg.com/vi/IQ4hGFWZ7vM/hqdefault.jpg,480,360,Eat Sleep Dream English,none,,,starbucks
SPiWnW6rdrA,2019-03-09T06:00:00.000Z,UCvc00uetYIML9D-7BBrEXLA,BELI SEMUA MENU KOPI DI STARBUCKS!!,"BELI SEMUA MENU KOPI DI STARBUCKS!! Share/bagikan video ini ke teman2mu!! dan juga ke semua sosial media kalian! Tulis komentar di bawah, video ...",https://i.ytimg.com/vi/SPiWnW6rdrA/default.jpg,120,90,https://i.ytimg.com/vi/SPiWnW6rdrA/mqdefault.jpg,320,180,https://i.ytimg.com/vi/SPiWnW6rdrA/hqdefault.jpg,480,360,Yudist Ardhana,none,,,
DBeXNMVVaxA,2017-06-23T00:00:00.000Z,UCaWd5_7JhbQBe4dknZhsHJg,Top 5 CREEPY Facts About Starbucks,Top 5 CREEPY Facts About Starbucks // Subscribe: http://goo.gl/Q2kKrD // Be sure to visit our Suggest Tool and Submit Ideas that you would like to see made ...,https://i.ytimg.com/vi/DBeXNMVVaxA/default.jpg,120,90,https://i.ytimg.com/vi/DBeXNMVVaxA/mqdefault.jpg,320,180,https://i.ytimg.com/vi/DBeXNMVVaxA/hqdefault.jpg,480,360,WatchMojo.com,none,,,
9CRNjrx34rs,2019-03-12T20:14:24.000Z,UC2rJLq19N0dGrxfib80M_fg,Ariana Grande A Fake Vegan Because Of Cloud Macchiato Starbucks Drink According To Fans,Hailey Baldwin reacts to Justin Bieber saying he's struggling. Ariana Grande faces major backlash for making a non vegan Starbucks drink. Plus – she's caught ...,https://i.ytimg.com/vi/9CRNjrx34rs/default.jpg,120,90,https://i.ytimg.com/vi/9CRNjrx34rs/mqdefault.jpg,320,180,https://i.ytimg.com/vi/9CRNjrx34rs/hqdefault.jpg,480,360,HollywoodLife,none,,,
yJ1ss_Ahb44,2015-04-02T01:00:00.000Z,UCp0hYYBW6IMayGgR-WeoCvQ,Starbucks Manners from Ellen,Ellen talked her audience through the ins and outs of appropriate Starbucks behavior.,https://i.ytimg.com/vi/yJ1ss_Ahb44/default.jpg,120,90,https://i.ytimg.com/vi/yJ1ss_Ahb44/mqdefault.jpg,320,180,https://i.ytimg.com/vi/yJ1ss_Ahb44/hqdefault.jpg,480,360,TheEllenShow,none,,,
e_uBCK6PNSg,2018-12-05T22:00:02.000Z,UCpko_-a4wgz2u_DgDgd9fqA,I Went To The Fanciest Starbucks In The World,"This Starbucks is almost half the size of a soccer field, has an in-house roastery AND an in-house bakery - it's WILD. Credits: ...",https://i.ytimg.com/vi/e_uBCK6PNSg/default.jpg,120,90,https://i.ytimg.com/vi/e_uBCK6PNSg/mqdefault.jpg,320,180,https://i.ytimg.com/vi/e_uBCK6PNSg/hqdefault.jpg,480,360,BuzzFeedVideo,none,,,
9ynNn8yGqQU,2019-03-08T22:41:24.000Z,UCCgDVqiPU10shxzmwkMwJ6A,Trying The Ariana Grande CLOUD Starbucks Drink!!!,Get my backpack HERE!!!: https://www.ecogear-products.com/product/samantha-cutie-backpack.html <U+2665> For Business Inquiries: business@beaufreshmedia.com ...,https://i.ytimg.com/vi/9ynNn8yGqQU/default.jpg,120,90,https://i.ytimg.com/vi/9ynNn8yGqQU/mqdefault.jpg,320,180,https://i.ytimg.com/vi/9ynNn8yGqQU/hqdefault.jpg,480,360,PiinkSparkles,none,,,
poi9Qz_lSg0,2019-01-20T16:00:02.000Z,UCcyq283he07B7_KUX07mmtA,Sneaky Ways Starbucks Gets You To Spend More Money,Starbucks always ends up costing a little more than expected. Seattle's biggest coffee chain has figured out how to keep its loyal Frappuccino-loving and iced ...,https://i.ytimg.com/vi/poi9Qz_lSg0/default.jpg,120,90,https://i.ytimg.com/vi/poi9Qz_lSg0/mqdefault.jpg,320,180,https://i.ytimg.com/vi/poi9Qz_lSg0/hqdefault.jpg,480,360,Business Insider,none,,,
6OqdG-ZcYC0,2019-02-11T14:00:00.000Z,UCGvIBxqin_rx3sY9qacQEhQ,Why You Should Absolutely Never Eat The Food At Starbucks,"It's no secret that Starbucks isn't cheap. And if you're thinking about also getting something to eat, you can plan on shelling out at least 10 to 20 bucks. There's an ...",https://i.ytimg.com/vi/6OqdG-ZcYC0/default.jpg,120,90,https://i.ytimg.com/vi/6OqdG-ZcYC0/mqdefault.jpg,320,180,https://i.ytimg.com/vi/6OqdG-ZcYC0/hqdefault.jpg,480,360,Mashed,none,,,
_FGUkxn5kZQ,2018-07-26T14:33:58.000Z,UCvJJ_dzjViJCoLf5uKUTwoA,Why Starbucks Failed In Australia,"Starbucks can be found all over the world, from Shanghai to Guantanamo Bay. But there is one continent that was uninterested in the coffee giant. Australians ...",https://i.ytimg.com/vi/_FGUkxn5kZQ/default.jpg,120,90,https://i.ytimg.com/vi/_FGUkxn5kZQ/mqdefault.jpg,320,180,https://i.ytimg.com/vi/_FGUkxn5kZQ/hqdefault.jpg,480,360,CNBC,none,,,
fQRt56aZnnk,2017-07-05T05:09:36.000Z,UCVmz3n15U7S52xShN8NCzsw,World&#39;s Most Beautiful Starbucks <U+2605> ONLY in JAPAN,"Where is the world's most beautiful Starbucks? Japan, of course. In Toyama city's Kansui Park is a shop that has won awards for it's design, but it's also the ...",https://i.ytimg.com/vi/fQRt56aZnnk/default.jpg,120,90,https://i.ytimg.com/vi/fQRt56aZnnk/mqdefault.jpg,320,180,https://i.ytimg.com/vi/fQRt56aZnnk/hqdefault.jpg,480,360,ONLY in JAPAN,none,,,
AM_xuUvWjZg,2019-03-14T15:40:34.000Z,UCXpszjVK17Wf7jf4zLz5Nnw,STARBUCKS VS COSTA,INSTAGRAM: @henrykettner Levelet erre a címre küldhetsz: 2600 Vác Galcsek utca 4. Gábor: http://instagram.com/gaborvincze Priszci: ...,https://i.ytimg.com/vi/AM_xuUvWjZg/default.jpg,120,90,https://i.ytimg.com/vi/AM_xuUvWjZg/mqdefault.jpg,320,180,https://i.ytimg.com/vi/AM_xuUvWjZg/hqdefault.jpg,480,360,Henry Kettner,none,,,
HSqPrtE374Q,2015-10-28T17:00:00.000Z,UCSrnmu3W6YXWU_85DKT5arg,Clever Way To Get FREE Starbucks!!,Subscribe- http://youtube.com/thatwasepic11 Second Channel- http://youtube.com/thatwasalmostepic Stay Updated- http://facebook.com/thatwasepic11 ...,https://i.ytimg.com/vi/HSqPrtE374Q/default.jpg,120,90,https://i.ytimg.com/vi/HSqPrtE374Q/mqdefault.jpg,320,180,https://i.ytimg.com/vi/HSqPrtE374Q/hqdefault.jpg,480,360,ThatWasEpic,none,,,
dVGBIrZNjAw,2018-05-04T23:13:55.000Z,UCoE23glWAPKpqdoZS3GHaVw,Come to work with me (starbucks)<U+0001F36E>,my registry for my son he's due in February ! https://www.target.com/gift-registry/gift/691b6b46942148a4b08346f383377741 ...,https://i.ytimg.com/vi/dVGBIrZNjAw/default.jpg,120,90,https://i.ytimg.com/vi/dVGBIrZNjAw/mqdefault.jpg,320,180,https://i.ytimg.com/vi/dVGBIrZNjAw/hqdefault.jpg,480,360,Raquel Isabel,none,,,
V5JSpC3AbAU,2019-03-14T21:10:47.000Z,UCr2UgEAjUu3cROHbNkp_JPQ,STARBUCKS MUKBANG!,welcome to my FIRST MUKBANG!! Eat Breakfast With Me (although it's 1pm in this video for me haha)! I hope you guys enjoy this STARBUCKS MUKBANG!,https://i.ytimg.com/vi/V5JSpC3AbAU/default.jpg,120,90,https://i.ytimg.com/vi/V5JSpC3AbAU/mqdefault.jpg,320,180,https://i.ytimg.com/vi/V5JSpC3AbAU/hqdefault.jpg,480,360,Rainbow Reality,none,,,
5i_TKMwy6o4,2015-11-23T13:00:00.000Z,UCT99Opr_eLKU0TJmw7A3X4w,10 Worst Types of Starbucks Customers,My Social Media: Instagram: https://www.instagram.com/kaikun2236/ Twitter: https://twitter.com/Kaikun2236 Snapchat: kaikun2236 My Youtube wishlist: ...,https://i.ytimg.com/vi/5i_TKMwy6o4/default.jpg,120,90,https://i.ytimg.com/vi/5i_TKMwy6o4/mqdefault.jpg,320,180,https://i.ytimg.com/vi/5i_TKMwy6o4/hqdefault.jpg,480,360,Kai Morgan,none,,,
n12iKLyEe8Q,2018-12-17T22:00:02.000Z,UCGvIBxqin_rx3sY9qacQEhQ,Workers Reveal The One Thing You Should Never Order From Starbucks,"Unless you want to drive your nearest Starbucks barista up the nearest tree, there's one thing you should never order, and that's any item off their so-called ...",https://i.ytimg.com/vi/n12iKLyEe8Q/default.jpg,120,90,https://i.ytimg.com/vi/n12iKLyEe8Q/mqdefault.jpg,320,180,https://i.ytimg.com/vi/n12iKLyEe8Q/hqdefault.jpg,480,360,Mashed,none,,,
z79duuC4I1Q,2018-11-10T12:45:04.000Z,UC66qTRH20AvahadBgw5YYyQ,Don’t Choose the Wrong Starbucks Slime Challenge,Don't Choose the Wrong Starbucks Slime Challenge Today Mary and Izzy played Don't Choose the Wrong Starbucks Slime Challenge!,https://i.ytimg.com/vi/z79duuC4I1Q/default.jpg,120,90,https://i.ytimg.com/vi/z79duuC4I1Q/mqdefault.jpg,320,180,https://i.ytimg.com/vi/z79duuC4I1Q/hqdefault.jpg,480,360,Life with Brothers,none,,,
4ttcIW14cSU,2016-02-06T16:29:31.000Z,UCjwmbv6NE4mOh8Z8VhPUx1Q,STARBUCKS CHALLENGE ft iJustine!,I got a lot of requests to do the Starbucks challenge! Let me know down below what other videos you would like to see! STARBUCKS CHALLENGE 2: ...,https://i.ytimg.com/vi/4ttcIW14cSU/default.jpg,120,90,https://i.ytimg.com/vi/4ttcIW14cSU/mqdefault.jpg,320,180,https://i.ytimg.com/vi/4ttcIW14cSU/hqdefault.jpg,480,360,Rosanna Pansino,none,,,
hPbrlNsMTg4,2014-09-08T19:54:07.000Z,UCr2dyt3W7U-erQmDazCbfcQ,Why Starbucks Spells Your Name Wrong | Agitators Ep. 1,Spoiler Alert: It's on purpose. Want a video like this? Email my production company: http://havingchanged.com Facebook: http://facebook.com/paulgalecomedy ...,https://i.ytimg.com/vi/hPbrlNsMTg4/default.jpg,120,90,https://i.ytimg.com/vi/hPbrlNsMTg4/mqdefault.jpg,320,180,https://i.ytimg.com/vi/hPbrlNsMTg4/hqdefault.jpg,480,360,Paul Gale Comedy,none,,,
GLBWky0u8LU,2019-03-09T22:13:53.000Z,UC0gQe6RljqpKt7_7hjNTCpQ,Starbucks Cloud Macchiato Taste Test!,Taste testing Starbuck's new cloud macchiato! Subscribe for more videos: https://goo.gl/ASvlVw —— <U+25B7>   Download my wallpapers!,https://i.ytimg.com/vi/GLBWky0u8LU/default.jpg,120,90,https://i.ytimg.com/vi/GLBWky0u8LU/mqdefault.jpg,320,180,https://i.ytimg.com/vi/GLBWky0u8LU/hqdefault.jpg,480,360,Jenna Ezarik,none,,,
DpPf1w04bG4,2016-11-04T17:00:30.000Z,UCc6W7efUSkd9YYoxOnctlFg,Types of People at Starbucks | Bethany Mota,Let's get this video to 100000 likes! Hey guys! What is your favorite Starbucks drink? Leave in the comments below! Watch my last video: ...,https://i.ytimg.com/vi/DpPf1w04bG4/default.jpg,120,90,https://i.ytimg.com/vi/DpPf1w04bG4/mqdefault.jpg,320,180,https://i.ytimg.com/vi/DpPf1w04bG4/hqdefault.jpg,480,360,Bethany Mota,none,,,
I5GcrAdyP70,2019-03-14T22:29:36.000Z,UCkBS_xU1WQ7FVsDoQ_OPeDg,Several Wounded After Woman Fires Pellet Gun Inside Andersonville Starbucks,"Blanca Montanez was charged with three counts of aggravated battery with a deadly weapon, two counts of aggravated battery to a peace officer, and two ...",https://i.ytimg.com/vi/I5GcrAdyP70/default.jpg,120,90,https://i.ytimg.com/vi/I5GcrAdyP70/mqdefault.jpg,320,180,https://i.ytimg.com/vi/I5GcrAdyP70/hqdefault.jpg,480,360,CBS Chicago,none,,,
P0OD7bajNxk,2019-03-14T07:57:41.000Z,UCFXNaD22mQK7tfcv_71J1sA,<U+30B9><U+30BF><U+30CF><U+3099><U+306E><U+798F><U+888B><U+306E><U+4E2D><U+8EAB><U+3092><U+7D39><U+4ECB>-Starbucks Lucky Bag-,<U+4ECA><U+56DE><U+306F><U+3001><U+30B9><U+30BF><U+30D0><U+306E><U+798F><U+888B><U+306E><U+4E2D><U+8EAB><U+3092><U+7D39><U+4ECB><U+3057><U+307E><U+3059>! <U+30C6><U+30FC><U+30DE><U+30D1><U+30FC><U+30AF><U+30AC><U+30FC><U+30EB>|Theme park Girl YouTube<U+21D2>https://www.youtube.com/c/themeparkgirl ...,https://i.ytimg.com/vi/P0OD7bajNxk/default.jpg,120,90,https://i.ytimg.com/vi/P0OD7bajNxk/mqdefault.jpg,320,180,https://i.ytimg.com/vi/P0OD7bajNxk/hqdefault.jpg,480,360,<U+30C6><U+30FC><U+30DE><U+30D1><U+30FC><U+30AF><U+30AC><U+30FC><U+30EB>,none,,,
_xUDjWVYOjY,2019-03-13T09:00:07.000Z,UCu5hJwMU5m14KKSH2AVfLcw,<U+0E40><U+0E14><U+0E47><U+0E01><U+0E08><U+0E34><U+0E4B><U+0E27>@<U+0E0D><U+0E35><U+0E48><U+0E1B><U+0E38><U+0E48><U+0E19> Ep2 <U+0E15><U+0E32><U+0E21><U+0E25><U+0E48><U+0E32><U+0E2B><U+0E32><U+0E41><U+0E01><U+0E49><U+0E27><U+0E0B><U+0E32><U+0E01><U+0E38><U+0E23><U+0E30><U+0E17><U+0E35><U+0E48> Starbucks <U+0E0D><U+0E35><U+0E48><U+0E1B><U+0E38><U+0E48><U+0E19>,<U+0E41><U+0E04><U+0E21><U+0E38><U+0E19><U+0E15><U+0E31><U+0E49><U+0E07><U+0E43><U+0E08><U+0E40><U+0E15><U+0E47><U+0E21><U+0E17><U+0E35><U+0E48><U+0E15><U+0E31><U+0E49><U+0E07><U+0E41><U+0E15><U+0E48><U+0E40><U+0E21><U+0E37><U+0E2D><U+0E07><U+0E44><U+0E17><U+0E22><U+0E41><U+0E25><U+0E49><U+0E27><U+0E04><U+0E48><U+0E30> <U+0E44><U+0E1B><U+0E16><U+0E36><U+0E07><U+0E0D><U+0E35><U+0E48><U+0E1B><U+0E38><U+0E48><U+0E19><U+0E08><U+0E30><U+0E15><U+0E49><U+0E2D><U+0E07><U+0E44><U+0E1B><U+0E15><U+0E32><U+0E21><U+0E2B><U+0E32>...,https://i.ytimg.com/vi/_xUDjWVYOjY/default.jpg,120,90,https://i.ytimg.com/vi/_xUDjWVYOjY/mqdefault.jpg,320,180,https://i.ytimg.com/vi/_xUDjWVYOjY/hqdefault.jpg,480,360,Dek Jew Small World,none,,,
#NAME?,2018-09-07T19:00:00.000Z,UCHVSseA5eTTguk_o5InXu9w,I Let Starbucks Baristas Pick My Drinks for a WEEK! *NYC EDITION!*,"You know I love coffee, https://youtu.be/ugc4OrUTrvE so while I was here in New York I let Starbucks baristas pick my drinks! for the week that I am here working.",https://i.ytimg.com/vi/-kgWeLZCeOE/default.jpg,120,90,https://i.ytimg.com/vi/-kgWeLZCeOE/mqdefault.jpg,320,180,https://i.ytimg.com/vi/-kgWeLZCeOE/hqdefault.jpg,480,360,Annie Rose,none,,,
ggQV3nKQ0ks,2017-09-15T13:50:45.000Z,UCscHytnpKxMblynXkY7eTNQ,STARBUCKS&#39;A ILK DEFA GIDECEKLERE ÖNERILER!!,"Herkese tekrardan merhabaaa<U+2764>   Bugun hem bana çok fazla sordugunuz sorulari cevapladigim, hemde Starbucks'a ilk defa gidecekler için yararli bilgiler ...",https://i.ytimg.com/vi/ggQV3nKQ0ks/default.jpg,120,90,https://i.ytimg.com/vi/ggQV3nKQ0ks/mqdefault.jpg,320,180,https://i.ytimg.com/vi/ggQV3nKQ0ks/hqdefault.jpg,480,360,Deniz Karasu,none,,,
QLsNuvkOPIc,2019-03-13T13:47:38.000Z,UC8p1vwvWtl6T73JiExfWs1g,Former Starbucks CEO Howard Schultz to unveil plans for leading country,"Former Starbucks CEO Howard Schultz said he would lead a charge to make a \transformative change\"" for the country if he decides to follow through with plans ...""",https://i.ytimg.com/vi/QLsNuvkOPIc/default.jpg,120,90,https://i.ytimg.com/vi/QLsNuvkOPIc/mqdefault.jpg,320,180,https://i.ytimg.com/vi/QLsNuvkOPIc/hqdefault.jpg,480,360,CBS News,none,,,
HZ3CjlWVnQY,2018-09-30T17:05:13.000Z,UCWI1AJmkMm_sbTX_Ps8gQAw,My Instagram Followers Pick My Starbucks Drinks for a Week...,I let my Instagram followers pick my Starbucks drinks for a week to see what drinks you guys would choose for me!! Comment if you participated in the polls for ...,https://i.ytimg.com/vi/HZ3CjlWVnQY/default.jpg,120,90,https://i.ytimg.com/vi/HZ3CjlWVnQY/mqdefault.jpg,320,180,https://i.ytimg.com/vi/HZ3CjlWVnQY/hqdefault.jpg,480,360,Sydney Serena,none,,,
br6yn2eQIoE,2019-03-14T23:16:20.000Z,UCosD5qU9L0l9fWXtprlEcog,r/EntitledParents CUT IN LINE AT STARBUCKS,JOIN THE RED ARMY AND SUBSCRIBE https://bit.ly/2Pj5weM r/EntitledParents BEST POSTS OF THE WEEK Entitled parents are the worst parents after anti ...,https://i.ytimg.com/vi/br6yn2eQIoE/default.jpg,120,90,https://i.ytimg.com/vi/br6yn2eQIoE/mqdefault.jpg,320,180,https://i.ytimg.com/vi/br6yn2eQIoE/hqdefault.jpg,480,360,RubbenRock,none,,,
oob8xrVROqM,2019-01-18T09:42:49.000Z,UCvc00uetYIML9D-7BBrEXLA,STARBUCKS BIASA VS STARBUCKS RESERVE DEWATA! APA BEDANYA??,STARBUCKS BIASA VS STARBUCKS RESERVED DEWATA! APA BEDANYA?? Share/bagikan video ini ke teman2mu!! dan juga ke semua sosial media kalian ...,https://i.ytimg.com/vi/oob8xrVROqM/default.jpg,120,90,https://i.ytimg.com/vi/oob8xrVROqM/mqdefault.jpg,320,180,https://i.ytimg.com/vi/oob8xrVROqM/hqdefault.jpg,480,360,Yudist Ardhana,none,,,
AsukMcIi30Y,2019-03-14T15:40:19.000Z,UC7Ij5ZCf2E9GmZ86cIw3vVg,Former Starbucks CEO Howard Schultz attacks Democrats for ‘tilt’ to socialism.,"Howard Schultz brought his not-quite-presidential-campaign to Miami, where he lauded South Florida's Cuban, Nicaraguan and Venezuelan exiles and then ...",https://i.ytimg.com/vi/AsukMcIi30Y/default.jpg,120,90,https://i.ytimg.com/vi/AsukMcIi30Y/mqdefault.jpg,320,180,https://i.ytimg.com/vi/AsukMcIi30Y/hqdefault.jpg,480,360,Miami Herald,none,,,
guSEx_KTNmc,2018-03-11T01:59:47.000Z,UCm9GAPznIYJ6cmMWbY48NIA,Inspired by Best of Starbucks Music Collection: Starbucks Inspired Coffee Music Youtube,Relax at Starbucks with this Starbucks inspired coffee music youtube playlist. This Starbucks jazz music inspired playlist is composed and recorded by Australian ...,https://i.ytimg.com/vi/guSEx_KTNmc/default.jpg,120,90,https://i.ytimg.com/vi/guSEx_KTNmc/mqdefault.jpg,320,180,https://i.ytimg.com/vi/guSEx_KTNmc/hqdefault.jpg,480,360,LewisLuong Relaxation Cafe,none,,,
2tmMWyZh4_A,2018-11-01T17:00:00.000Z,UCR8JH5xCiXalvi4DYLC_g_A,Letting Starbucks Baristas Pick Our Drinks For A Week...,Letting Starbucks Baristas Pick Our Drinks For A Week... While I was in LA I decided to let the Starbucks baristas pick my drinks for the whole week I was there!,https://i.ytimg.com/vi/2tmMWyZh4_A/default.jpg,120,90,https://i.ytimg.com/vi/2tmMWyZh4_A/mqdefault.jpg,320,180,https://i.ytimg.com/vi/2tmMWyZh4_A/hqdefault.jpg,480,360,Jazzybum,none,,,
QY9EfmB5Dr4,2019-01-28T15:00:02.000Z,UCHEqoPq5lQV_ckyvFruNhAQ,STARBUCKS&#39;DAKI TÜM MENÜYÜ SIPARIS ETTIM!!! (Kafein Komasi),Bugün Starbucks'a gidip bütün menüyü siparis ettim ve bütün içecekleri sizin için denedim umarim bu videoda eglenmissinizdir. Sizi seviyorum. Videoyu ...,https://i.ytimg.com/vi/QY9EfmB5Dr4/default.jpg,120,90,https://i.ytimg.com/vi/QY9EfmB5Dr4/mqdefault.jpg,320,180,https://i.ytimg.com/vi/QY9EfmB5Dr4/hqdefault.jpg,480,360,Meryem Can,none,,,
92QNTyGINk0,2019-03-13T09:32:39.000Z,UC1fmAB3BXqmGZEyZdWnR7ZQ,VLOG | Cu<U+1ED9>c S<U+1ED1>ng Nh<U+1EAD>t B<U+1EA3>n : T<U+1EE5> H<U+1ECD>p B<U+1EA1>n Bè Ði StarBucks Coffee L<U+1EDB>n Nh<U+1EA5>t Th<U+1EBF> Gi<U+1EDB>i <U+1EDF> Nh<U+1EAD>t,VLOG | Cu<U+1ED9>c S<U+1ED1>ng Nh<U+1EAD>t B<U+1EA3>n : T<U+1EE5> H<U+1ECD>p B<U+1EA1>n Bè Ði StarBucks Coffee L<U+1EDB>n Nh<U+1EA5>t Th<U+1EBF> Gi<U+1EDB>i <U+1EDF> Nh<U+1EAD>t Ðang ý kênh d<U+1EC3> nh<U+1EAD>n video m<U+1EDB>i nhá ...,https://i.ytimg.com/vi/92QNTyGINk0/default.jpg,120,90,https://i.ytimg.com/vi/92QNTyGINk0/mqdefault.jpg,320,180,https://i.ytimg.com/vi/92QNTyGINk0/hqdefault.jpg,480,360,Bình Bông JP,none,,,
ehYHZsvtVVE,2019-01-17T11:00:06.000Z,UCzpCc5n9hqiVC7HhPwcIKEg,Starbucks Pastries Taste Test,We're rounding out our Starbucks orders with some pastries! But which ones would we come back for? GMMore #1463 Watch today's GMM: ...,https://i.ytimg.com/vi/ehYHZsvtVVE/default.jpg,120,90,https://i.ytimg.com/vi/ehYHZsvtVVE/mqdefault.jpg,320,180,https://i.ytimg.com/vi/ehYHZsvtVVE/hqdefault.jpg,480,360,Good Mythical MORE,none,,,
iUdEXvR3HpA,2018-09-01T21:22:55.000Z,UCSQDtOJbY_OzfdpGVf1Zpog,Trying Starbucks Baristas Favorite Drinks For A Week | Lindsay Rae,Hey guys!!! I'm so excited to post this video because it was so much fun to film! Last week I went to Starbucks everyday and asked the barista if they could make ...,https://i.ytimg.com/vi/iUdEXvR3HpA/default.jpg,120,90,https://i.ytimg.com/vi/iUdEXvR3HpA/mqdefault.jpg,320,180,https://i.ytimg.com/vi/iUdEXvR3HpA/hqdefault.jpg,480,360,Lindsay Rae,none,,,
35jEUxR2rXY,2019-01-18T20:34:40.000Z,UC_r3trI6eIaptK0zTdhAEqg,WE ORDERED EVERY FRAPPUCCINO FROM STARBUCKS!,Make sure you are subscribed and have your bell on!!! Watch us order from every pizza place here https://www.youtube.com/watch?v=ECIWnwIc6SI WE ALSO ...,https://i.ytimg.com/vi/35jEUxR2rXY/default.jpg,120,90,https://i.ytimg.com/vi/35jEUxR2rXY/mqdefault.jpg,320,180,https://i.ytimg.com/vi/35jEUxR2rXY/hqdefault.jpg,480,360,SmellyBellyTV,none,,,
Fb6jxie0kf8,2019-02-22T14:44:10.000Z,UCbRqvz-2FkZh7XUY7fAazlg,<U+0627><U+062F><U+0647><U+0645> <U+0646><U+0648><U+0631> ( <U+0645><U+0639>. <U+0627><U+0646><U+0628><U+0644><U+0627><U+0646><U+0635> )- <U+0633><U+062A><U+0627><U+0631><U+0628><U+0627><U+0643><U+0633>/ Adham Nour ( feat. Unbalance )-(prod marwan moussa )- Starbucks,<U+0627><U+062F><U+0647><U+0645> <U+0646><U+0648><U+0631> ( <U+0645><U+0639>. <U+0627><U+0646><U+0628><U+0644><U+0627><U+0646><U+0635> )- <U+0633><U+062A><U+0627><U+0631><U+0628><U+0627><U+0643><U+0633> / Adham Nour ( feat. Unbalance ) StarBucks. <U+0643><U+0644><U+0645><U+0627><U+062A> <U+0639><U+0631><U+0628><U+064A><U+0647> <U+0623><U+062F><U+0647><U+0645> <U+0646><U+0648><U+0631> - <U+0643><U+0644><U+0645><U+0627><U+062A> <U+0627><U+0646><U+062C><U+0644><U+064A><U+0632>...,https://i.ytimg.com/vi/Fb6jxie0kf8/default.jpg,120,90,https://i.ytimg.com/vi/Fb6jxie0kf8/mqdefault.jpg,320,180,https://i.ytimg.com/vi/Fb6jxie0kf8/hqdefault.jpg,480,360,Adham Nour,none,,,
nSYLImISaG0,2017-11-07T02:30:05.000Z,UCm9GAPznIYJ6cmMWbY48NIA,Inspired by Best of Starbucks Music Collection: Starbucks Inspired Coffee Music Youtube,Relax at Starbucks with this Starbucks inspired coffee music youtube playlist. This Starbucks jazz music inspired playlist is composed and recorded by Australian ...,https://i.ytimg.com/vi/nSYLImISaG0/default.jpg,120,90,https://i.ytimg.com/vi/nSYLImISaG0/mqdefault.jpg,320,180,https://i.ytimg.com/vi/nSYLImISaG0/hqdefault.jpg,480,360,LewisLuong Relaxation Cafe,none,,,
YVa6_i8msnY,2018-09-21T13:00:08.000Z,UC83jt4dlz1Gjl58fzQrrKZg,How Starbucks nearly collapsed | Inside The Storm | Full episode,"With untrendy cafes, bad-tasting coffee and an insatiable thirst for expansion, the world's biggest coffee empire was on the brink of collapse. How did one man ...",https://i.ytimg.com/vi/YVa6_i8msnY/default.jpg,120,90,https://i.ytimg.com/vi/YVa6_i8msnY/mqdefault.jpg,320,180,https://i.ytimg.com/vi/YVa6_i8msnY/hqdefault.jpg,480,360,Channel NewsAsia,none,,,
dxoMBvT-eJs,2019-02-13T22:00:08.000Z,UCpko_-a4wgz2u_DgDgd9fqA,We Try Every Starbucks Bakery Item,"\It's more food that we need to eat.\"" Credits: https://www.buzzfeed.com/bfmp/videos/76021 Check out more awesome videos at BuzzFeedVideo!""",https://i.ytimg.com/vi/dxoMBvT-eJs/default.jpg,120,90,https://i.ytimg.com/vi/dxoMBvT-eJs/mqdefault.jpg,320,180,https://i.ytimg.com/vi/dxoMBvT-eJs/hqdefault.jpg,480,360,BuzzFeedVideo,none,,,
mF0aBalc38U,2018-12-08T17:45:00.000Z,UCVgbzHAKAkoplFsSGyba14w,Letting My Instagram Followers Choose My Starbucks Drinks For A Week (from the secret menu)!!,Letting My Instagram Followers Choose My Starbucks Drinks For A Week (from the secret menu)!! While I was in LA I let my Instagram followers pick my ...,https://i.ytimg.com/vi/mF0aBalc38U/default.jpg,120,90,https://i.ytimg.com/vi/mF0aBalc38U/mqdefault.jpg,320,180,https://i.ytimg.com/vi/mF0aBalc38U/hqdefault.jpg,480,360,Jazzy Vlogs,none,,,
