video_id,publishedAt,channelId,title,description,thumbnails.default.url,thumbnails.default.width,thumbnails.default.height,thumbnails.medium.url,thumbnails.medium.width,thumbnails.medium.height,thumbnails.high.url,thumbnails.high.width,thumbnails.high.height,channelTitle,liveBroadcastContent,,,
zsK7DnPIweE,2015-09-15T18:12:46.000Z,UChaDGuAPAwB2toykPUAy_mw,"Justin Bieber fans fall down, cry and scream outside Starbucks",Fans gather by the hundreds outside a Starbucks in Germany as pop superstar Justin Bieber is spotted inside. One fan fell off a table and others were seen ...,https://i.ytimg.com/vi/zsK7DnPIweE/default.jpg,120,90,https://i.ytimg.com/vi/zsK7DnPIweE/mqdefault.jpg,320,180,https://i.ytimg.com/vi/zsK7DnPIweE/hqdefault.jpg,480,360,Stupid Famous People,none,,,
nSGTiCcndUc,2017-06-28T19:48:09.000Z,UCnsvJeZO4RigQ898WdDNoBw,"Bacterias fecales en bebidas frías de Starbucks, Costa Coffee y Caffé Nero |Internacional","Una investigación de la BBC ha encontrado bacterias fecales en las bebidas frías de las grandes cadenas Starbucks, Costa Coffee y Caffé Nero en Reino ...",https://i.ytimg.com/vi/nSGTiCcndUc/default.jpg,120,90,https://i.ytimg.com/vi/nSGTiCcndUc/mqdefault.jpg,320,180,https://i.ytimg.com/vi/nSGTiCcndUc/hqdefault.jpg,480,360,EL PAIS,none,,,
HxlGI4OzeBk,2012-11-28T08:48:48.000Z,UCa6vGFO9ty8v5KZJXQxdhaw,New $7 Cup of Coffee at Starbucks,Jimmy Kimmel Live - New $7 Cup of Coffee at Starbucks SUBSCRIBE to get the latest #KIMMEL: http://bit.ly/JKLSubscribe Watch the latest Mean Tweets: ...,https://i.ytimg.com/vi/HxlGI4OzeBk/default.jpg,120,90,https://i.ytimg.com/vi/HxlGI4OzeBk/mqdefault.jpg,320,180,https://i.ytimg.com/vi/HxlGI4OzeBk/hqdefault.jpg,480,360,Jimmy Kimmel Live,none,,,
A4QERRsfVPc,2017-04-22T14:10:37.000Z,UCtZAaljDNIsIAIhwYYzvEiw,STARBUCKS UNICORN FRAPPUCCINO AT HOME!! - DIY,We made our own delicious Starbucks Unicorn Frappuccino's at home and you can too! Click Here To Join The Family! <U+25BB> http://bit.ly/ehbeefamily Check us out ...,https://i.ytimg.com/vi/A4QERRsfVPc/default.jpg,120,90,https://i.ytimg.com/vi/A4QERRsfVPc/mqdefault.jpg,320,180,https://i.ytimg.com/vi/A4QERRsfVPc/hqdefault.jpg,480,360,Eh Bee Family,none,,,
3z4aQWMsHlY,2019-03-11T12:41:29.000Z,UC4vxAUZw527kHf7SrVKJsAQ,STARBUCKS RESERVE ROASTERY TOKYO (The biggest Starbucks in Japan),,https://i.ytimg.com/vi/3z4aQWMsHlY/default.jpg,120,90,https://i.ytimg.com/vi/3z4aQWMsHlY/mqdefault.jpg,320,180,https://i.ytimg.com/vi/3z4aQWMsHlY/hqdefault.jpg,480,360,Mareng Abby,none,,,
bREaFbsVi40,2014-03-13T14:00:04.000Z,UCp0hYYBW6IMayGgR-WeoCvQ,"80,000 Kinds of Starbucks",Ellen discovered a surprising fact about the famous coffee chain. Find out what it is!,https://i.ytimg.com/vi/bREaFbsVi40/default.jpg,120,90,https://i.ytimg.com/vi/bREaFbsVi40/mqdefault.jpg,320,180,https://i.ytimg.com/vi/bREaFbsVi40/hqdefault.jpg,480,360,TheEllenShow,none,,,
T_9ktf6wVhs,2018-05-21T22:51:56.000Z,UCaeO5vkdj5xOQHp4UmIN6dw,Starbucks Caves To Leftist Narrative,Michael Knowles laments the news that Starbucks has decided to cave on the issue of bathroom use for nonpaying customers.,https://i.ytimg.com/vi/T_9ktf6wVhs/default.jpg,120,90,https://i.ytimg.com/vi/T_9ktf6wVhs/mqdefault.jpg,320,180,https://i.ytimg.com/vi/T_9ktf6wVhs/hqdefault.jpg,480,360,The Daily Wire,none,,,
EHKdFVlQUig,2015-08-21T18:07:48.000Z,UCj4nCgtjKJppK_IZeY8TUJg,Starbucks College Achievement Plan: Kimmie’s Story,I feel myself growing. I feel my knowledge expanding and it's all because of Arizona State and just the classes I've taken there.” Learn more about the Starbucks ...,https://i.ytimg.com/vi/EHKdFVlQUig/default.jpg,120,90,https://i.ytimg.com/vi/EHKdFVlQUig/mqdefault.jpg,320,180,https://i.ytimg.com/vi/EHKdFVlQUig/hqdefault.jpg,480,360,Starbucks Coffee,none,,,
bUQ4Eg8PFVM,2018-10-26T19:00:02.000Z,UCdlNK1xcy-Sn8liq7feNxWw,Starbucks and McDonald&#39;s Secret to Success- Grant Cardone,"Our offerings under Rule 506(c) are for accredited investors only. GENERALLY, NO SALE MAY BE MADE TO YOU IN THIS OFFERING IF THE AGGREGATE ...",https://i.ytimg.com/vi/bUQ4Eg8PFVM/default.jpg,120,90,https://i.ytimg.com/vi/bUQ4Eg8PFVM/mqdefault.jpg,320,180,https://i.ytimg.com/vi/bUQ4Eg8PFVM/hqdefault.jpg,480,360,Grant Cardone,none,,,
kuvZkObA-8Q,2019-03-08T23:41:26.000Z,UC3SafDS4jxWKROqzPaON0lA,Trying Ariana Grande&#39;s Starbucks Drink! (caramel cloud macchiato) <U+0001F49A>,I tried Ariana Grande's new starbucks drink which is the ICED CARAMEL CLOUD MACCHIATO and oh! I also bought a wig and let me tell you that it flew off the ...,https://i.ytimg.com/vi/kuvZkObA-8Q/default.jpg,120,90,https://i.ytimg.com/vi/kuvZkObA-8Q/mqdefault.jpg,320,180,https://i.ytimg.com/vi/kuvZkObA-8Q/hqdefault.jpg,480,360,MaybeHeilly,none,,,
L4DiZHWlZJM,2016-01-22T11:15:15.000Z,UCHcMtE3EiKmqrJZBZyUBuRQ,The REAL reason Starbucks got its logo | Robot Chicken | Adult Swim,Robot Chicken lifts the lid once and for all how Starbucks got their iconic logo. Watch Adult Swim every Thursday at 11pm on FOX UK. Subscribe to the Adult ...,https://i.ytimg.com/vi/L4DiZHWlZJM/default.jpg,120,90,https://i.ytimg.com/vi/L4DiZHWlZJM/mqdefault.jpg,320,180,https://i.ytimg.com/vi/L4DiZHWlZJM/hqdefault.jpg,480,360,Adult Swim UK,none,,,
vq4QdfY1Zrs,2016-03-28T19:30:55.000Z,UCHJuQZuzapBh-CuhRYxIZrg,New machines could destroy Starbucks,"These machines from \Wheelys\"" are designed to destroy Starbucks and save the world.""",https://i.ytimg.com/vi/vq4QdfY1Zrs/default.jpg,120,90,https://i.ytimg.com/vi/vq4QdfY1Zrs/mqdefault.jpg,320,180,https://i.ytimg.com/vi/vq4QdfY1Zrs/hqdefault.jpg,480,360,INSIDER,none,,,
_XX4gqRq1wY,2013-04-24T00:07:48.000Z,UCxnTbYP0SQjkterQLOTM8NQ,The History of Starbucks,History of Starbucks Video Prepared for an International Business project at Adelphi University about implementing a Starbucks Coffeehouse in Jamaica.,https://i.ytimg.com/vi/_XX4gqRq1wY/default.jpg,120,90,https://i.ytimg.com/vi/_XX4gqRq1wY/mqdefault.jpg,320,180,https://i.ytimg.com/vi/_XX4gqRq1wY/hqdefault.jpg,480,360,Danielle Clark,none,,,
Jf06V-HMycY,2011-11-03T02:26:28.000Z,UC574v3DrZsqs9bo47shaUSA,Origami Starbucks Paper Bag Wallet,"Create an origami wallet from a Starbucks paper bag. Also great for giving gift cards. Make this wallet from other paper, or tyvek! http://youtu.be/u_1jMH9cHjI.",https://i.ytimg.com/vi/Jf06V-HMycY/default.jpg,120,90,https://i.ytimg.com/vi/Jf06V-HMycY/mqdefault.jpg,320,180,https://i.ytimg.com/vi/Jf06V-HMycY/hqdefault.jpg,480,360,thebigbluevan,none,,,
dSRsRtYGgoA,2018-04-19T01:00:01.000Z,UCIveFvW-ARp_B_RckhweNJw,The “Systemic Racism” HOAX: Starbucks Is the Latest Casualty… | Louder With Crowder,"In the wake of Starbucks' “racist incident”, Steven Crowder breaks down the difference between systemic racism and anecdotal evidence of individual racism.",https://i.ytimg.com/vi/dSRsRtYGgoA/default.jpg,120,90,https://i.ytimg.com/vi/dSRsRtYGgoA/mqdefault.jpg,320,180,https://i.ytimg.com/vi/dSRsRtYGgoA/hqdefault.jpg,480,360,StevenCrowder,none,,,
tRIX9G7D_9Q,2016-03-25T16:23:24.000Z,UCj4nCgtjKJppK_IZeY8TUJg,How To: AeroPress®,"With its remarkable simplicity and quick brew time, the AeroPress® has amassed a devoted following. Not only is it fun to use, it's easy to clean and consistently ...",https://i.ytimg.com/vi/tRIX9G7D_9Q/default.jpg,120,90,https://i.ytimg.com/vi/tRIX9G7D_9Q/mqdefault.jpg,320,180,https://i.ytimg.com/vi/tRIX9G7D_9Q/hqdefault.jpg,480,360,Starbucks Coffee,none,,,
Y4HrnOAeDt4,2015-09-04T07:30:02.000Z,UCa6vGFO9ty8v5KZJXQxdhaw,Andrew Garfield Worked at Starbucks,Andrew talks about his long hair and recalls his first job working at a Starbucks in England. SUBSCRIBE to get the latest #KIMMEL: http://bit.ly/JKLSubscribe ...,https://i.ytimg.com/vi/Y4HrnOAeDt4/default.jpg,120,90,https://i.ytimg.com/vi/Y4HrnOAeDt4/mqdefault.jpg,320,180,https://i.ytimg.com/vi/Y4HrnOAeDt4/hqdefault.jpg,480,360,Jimmy Kimmel Live,none,,,
tf7riZWxkoY,2016-11-18T20:59:20.000Z,UCzUV5283-l5c0oKRtyenj6Q,Starbucks Calls Cops On &quot;Trump Cup&quot; Customer,"Starbucks calls the police on customer for saying his name was \Trump\"" because that's what name he wanted written on his cup when his coffee was ready.""",https://i.ytimg.com/vi/tf7riZWxkoY/default.jpg,120,90,https://i.ytimg.com/vi/tf7riZWxkoY/mqdefault.jpg,320,180,https://i.ytimg.com/vi/tf7riZWxkoY/hqdefault.jpg,480,360,Mark Dice,none,,,
UMr6ylOiAqY,2017-01-29T06:04:43.000Z,UCQ1RT1MuhKBRYlg2Z8_U4MA,STARBUCKS CELEBRITY GOLD Digger Prank in India,STARBUCKS Digger GOLD Digger Prank in India Subscribe : http://goo.gl/UJFAhh Facebook : https://www.facebook.com/tamashabera Instagram ...,https://i.ytimg.com/vi/UMr6ylOiAqY/default.jpg,120,90,https://i.ytimg.com/vi/UMr6ylOiAqY/mqdefault.jpg,320,180,https://i.ytimg.com/vi/UMr6ylOiAqY/hqdefault.jpg,480,360,TamashaBera,none,,,
76XJHLs4WpM,2017-12-15T20:00:01.000Z,UClWD8su9Sk6GzZDwy9zs3_w,TRYING EVERY SINGLE STARBUCKS HOLIDAY DRINK.. (disgusting),Buy Hefner Merch: https://fanjoy.co/collections/tana-mo... Watch Official Music Video: https://goo.gl/Fs3LsX Watch Behind The Scenes: https://goo.gl/VEacuj ...,https://i.ytimg.com/vi/76XJHLs4WpM/default.jpg,120,90,https://i.ytimg.com/vi/76XJHLs4WpM/mqdefault.jpg,320,180,https://i.ytimg.com/vi/76XJHLs4WpM/hqdefault.jpg,480,360,Tana Mongeau,none,,,
OKmpQ_3w4tA,2018-12-19T16:32:07.000Z,UCT9bW9Kwj_BHZFZF1KWKc-g,Rozwijaj sie jako manager w Starbucks Warszawa!,"Jesli zalezy Ci na mozliwosciach rozwoju i pracy, w której bedziesz bedziesz mógl wdrazac w zycie swoje pomysly, to Starbucks jest miejscem idealnym dla ...",https://i.ytimg.com/vi/OKmpQ_3w4tA/default.jpg,120,90,https://i.ytimg.com/vi/OKmpQ_3w4tA/mqdefault.jpg,320,180,https://i.ytimg.com/vi/OKmpQ_3w4tA/hqdefault.jpg,480,360,AmRest,none,,,
D7_dZTrjw9I,2008-10-31T02:33:49.000Z,UCDgakbv9zOn4Pprt38VZdxg,What if Starbucks Marketed Like a Church? A Parable.,What if Starbucks Marketed Like a Church? A Parable.,https://i.ytimg.com/vi/D7_dZTrjw9I/default.jpg,120,90,https://i.ytimg.com/vi/D7_dZTrjw9I/mqdefault.jpg,320,180,https://i.ytimg.com/vi/D7_dZTrjw9I/hqdefault.jpg,480,360,Artistry Labs,none,,,
VOA23EySTfY,2017-09-28T16:48:52.000Z,UC46bbTJr6CM0Z8HtxEqUsdg,Coffee Taste Test: Tim Hortons VS. Starbucks VS. The Spoke,We did a blind taste test of all the coffee on campus. Can you tell the difference between Starbucks and Tims? Produced by Connor Malbeuf Video and graphics ...,https://i.ytimg.com/vi/VOA23EySTfY/default.jpg,120,90,https://i.ytimg.com/vi/VOA23EySTfY/mqdefault.jpg,320,180,https://i.ytimg.com/vi/VOA23EySTfY/hqdefault.jpg,480,360,Western TV,none,,,
TdWSpaFeJKw,2019-03-06T00:45:54.000Z,UCAmvqdWsZyGW0S5WZRPoiqQ,trying the new Ariana Grande Starbucks drink!! (iced caramel cloud macchiato),this is the second upload because the first one was cut in half for some reason hahah but it also includes a target run subscribe for new videos weekly ...,https://i.ytimg.com/vi/TdWSpaFeJKw/default.jpg,120,90,https://i.ytimg.com/vi/TdWSpaFeJKw/mqdefault.jpg,320,180,https://i.ytimg.com/vi/TdWSpaFeJKw/hqdefault.jpg,480,360,ange toss,none,,,
Be5fCPohYEU,2012-05-09T17:06:10.000Z,UCWo4IA01TXzBeGJJKWHOG9g,How Starbucks Trains Customers to Behave,"Anne Morriss, managing director of the Concire Leadership Institute, explains how the coffee giant increased efficiency and satisfaction by treating customers ...",https://i.ytimg.com/vi/Be5fCPohYEU/default.jpg,120,90,https://i.ytimg.com/vi/Be5fCPohYEU/mqdefault.jpg,320,180,https://i.ytimg.com/vi/Be5fCPohYEU/hqdefault.jpg,480,360,Harvard Business Review,none,,,
qlLpaD4FEKQ,2015-10-13T20:45:57.000Z,UCBs5YS0JTDAU5hwN9bGVk_A,Shaq&#39;s biggest business mistake: Turning down Starbucks,"Shaquille O'Neal recalls a missed opportunity with Starbucks CEO, Howard Schultz and a lesson from a car wash.",https://i.ytimg.com/vi/qlLpaD4FEKQ/default.jpg,120,90,https://i.ytimg.com/vi/qlLpaD4FEKQ/mqdefault.jpg,320,180,https://i.ytimg.com/vi/qlLpaD4FEKQ/hqdefault.jpg,480,360,Graham Bensinger,none,,,
#NAME?,2012-12-12T17:48:13.000Z,UCIexKuGVoV_huv8ffdXSo6w,Hidden Costs Series: Starbucks,View full post: http://www.insurancequotes.org/hidden-cost-starbucks You're probably sitting within a mile of six Starbucks where you can blow $6 on a 780 ...,https://i.ytimg.com/vi/-ppkVx0fRPY/default.jpg,120,90,https://i.ytimg.com/vi/-ppkVx0fRPY/mqdefault.jpg,320,180,https://i.ytimg.com/vi/-ppkVx0fRPY/hqdefault.jpg,480,360,Hidden Costs,none,,,
wqz6VSnCS0I,2013-04-29T19:21:16.000Z,UCMy7MM4FGNwJeUucAZ8KP-w,Starbucks México | Mural Starbucks Refreshers,"Con motivo del lanzamiento de Starbucks Refreshers™ en México, un grupo de cuatro artistas mexicanos desarrollaron un billboard hecho a mano de 25 x 20 ...",https://i.ytimg.com/vi/wqz6VSnCS0I/default.jpg,120,90,https://i.ytimg.com/vi/wqz6VSnCS0I/mqdefault.jpg,320,180,https://i.ytimg.com/vi/wqz6VSnCS0I/hqdefault.jpg,480,360,Starbucks México,none,,,
Kw-bMMAqx1k,2014-06-10T17:14:03.000Z,UC1aJuxLHlw8bBV6mfCqVfog,Make 3 Frappuccinos From Starbucks&#39; Secret Menu | Eat the Trend,"Starbucks' secret menu has legions of loyalists, and it's no surprise as to why: it's fun to order off-menu, but more importantly, these spins on Starbucks' classic ...",https://i.ytimg.com/vi/Kw-bMMAqx1k/default.jpg,120,90,https://i.ytimg.com/vi/Kw-bMMAqx1k/mqdefault.jpg,320,180,https://i.ytimg.com/vi/Kw-bMMAqx1k/hqdefault.jpg,480,360,POPSUGAR Food,none,,,
81MiV5Y2Af4,2015-05-29T20:30:11.000Z,UC6gqv2Naj9JiowZgHfPstmg,DIY STARBUCKS EOS - Make your own STARBUCKS Lip Balm!,DIY Starbucks EOS! Make your own Starbucks Lip Balm <U+2665> Can we get this video to 10000 likes?! :D Click here to SUBSCRIBE:http://goo.gl/fKnKR6 <U+2665> Hi Guys!,https://i.ytimg.com/vi/81MiV5Y2Af4/default.jpg,120,90,https://i.ytimg.com/vi/81MiV5Y2Af4/mqdefault.jpg,320,180,https://i.ytimg.com/vi/81MiV5Y2Af4/hqdefault.jpg,480,360,HelloMaphie,none,,,
6SDIc6bGw9w,2014-05-04T00:27:04.000Z,UCSsWVbuWPo55brIK5RN6eXQ,&quot;Do You Wanna Go To Starbucks?&quot;,"Make sure you have enough caffeine for your finals. #doyouwannagotostarbucks This is a mini-musical parody on Frozen's song \Do You Wanna Build a ...""",https://i.ytimg.com/vi/6SDIc6bGw9w/default.jpg,120,90,https://i.ytimg.com/vi/6SDIc6bGw9w/mqdefault.jpg,320,180,https://i.ytimg.com/vi/6SDIc6bGw9w/hqdefault.jpg,480,360,Olivia Mowry,none,,,
3KK4ZVP-5WY,2015-04-28T22:24:27.000Z,UCHCZGUHS320CJ3mHgCnZ8tg,NEW Starbucks S&#39;MORES Frappuccino Review FAIL!,Kory DeSoto reviews the NEW Starbucks S'mores Frapachino that came out today! The outcome is not good... FOLLOW KORY: SNAPCHAT: KORSOTO ...,https://i.ytimg.com/vi/3KK4ZVP-5WY/default.jpg,120,90,https://i.ytimg.com/vi/3KK4ZVP-5WY/mqdefault.jpg,320,180,https://i.ytimg.com/vi/3KK4ZVP-5WY/hqdefault.jpg,480,360,Kory DeSoto,none,,,
iplYoZ42O0M,2017-02-06T23:44:29.000Z,UCCXoCcu9Rp7NPbTzIvogpZg,Why this Coffee CEO is calling out Starbucks,Black Rifle Coffee founder & CEO Evan Hafer on why he wants to hire 10000 U.S. veterans.,https://i.ytimg.com/vi/iplYoZ42O0M/default.jpg,120,90,https://i.ytimg.com/vi/iplYoZ42O0M/mqdefault.jpg,320,180,https://i.ytimg.com/vi/iplYoZ42O0M/hqdefault.jpg,480,360,Fox Business,none,,,
Uc0BtRoaS6I,2018-08-30T22:28:36.000Z,UCYjk_zY-iYR8YNfJmuzd70A,7 MILLION SCOVILLE SPICY STARBUCKS feat. Austin Creed,This week we create a 7million scoville Starbucks coffee. the spiciest coffee ever. We have 5x WWE Tag Team Champion Xavier Woods & host of Up Up Down ...,https://i.ytimg.com/vi/Uc0BtRoaS6I/default.jpg,120,90,https://i.ytimg.com/vi/Uc0BtRoaS6I/mqdefault.jpg,320,180,https://i.ytimg.com/vi/Uc0BtRoaS6I/hqdefault.jpg,480,360,Epic Meal Time,none,,,
wy13zKfHCBM,2016-05-06T22:08:56.000Z,UC3dEvA1is6-0_yuei9iCdEw,How to Draw a Starbucks Frappuccino Cute | Cartoon Drink,"What's your favorite Starbucks drink? Learn step by step how to draw a cute Starbuck Frappuccino. Thanks for watching!! Please LIKE, COMMENT, and SHARE.",https://i.ytimg.com/vi/wy13zKfHCBM/default.jpg,120,90,https://i.ytimg.com/vi/wy13zKfHCBM/mqdefault.jpg,320,180,https://i.ytimg.com/vi/wy13zKfHCBM/hqdefault.jpg,480,360,Draw So Cute,none,,,
t2h8Wwp2hZI,2019-03-12T03:53:46.000Z,UCzF4Ryn8TKn64md77gS5Q5Q,Former Starbucks CEO Howard Schultz visits Atlanta,He stopped by the Jimmy Carter Presidential Library as part of the library's author series.,https://i.ytimg.com/vi/t2h8Wwp2hZI/default.jpg,120,90,https://i.ytimg.com/vi/t2h8Wwp2hZI/mqdefault.jpg,320,180,https://i.ytimg.com/vi/t2h8Wwp2hZI/hqdefault.jpg,480,360,11Alive,none,,,
bx2cVtPsOyU,2015-04-02T13:35:52.000Z,UCEMNq-kllgO3Z-YQA2QVz-w,Personalized $2 Starbucks Cups,Design Space Shared File https://design.cricut.com/#/design/25191840 Questions or comments? Post them down below!! Buy your vinyl from me at ...,https://i.ytimg.com/vi/bx2cVtPsOyU/default.jpg,120,90,https://i.ytimg.com/vi/bx2cVtPsOyU/mqdefault.jpg,320,180,https://i.ytimg.com/vi/bx2cVtPsOyU/hqdefault.jpg,480,360,TroyTube,none,,,
5_pKKO35Kh4,2013-11-26T15:54:01.000Z,UCTrtA2LyW7gie0o8hY4efXw,&quot;I Am Spartacus!&quot; Starbucks Prank - Movies In Real Life (Ep 9),Full Story: https://improveverywhere.com/2013/11/26/spartacus-in-real-life-movies-in-real-life-episode-9/ SUBSCRIBE: http://bit.ly/iesub Join Us: ...,https://i.ytimg.com/vi/5_pKKO35Kh4/default.jpg,120,90,https://i.ytimg.com/vi/5_pKKO35Kh4/mqdefault.jpg,320,180,https://i.ytimg.com/vi/5_pKKO35Kh4/hqdefault.jpg,480,360,Improv Everywhere,none,,,
KGZZsysMjn4,2013-05-09T19:48:21.000Z,UCj4nCgtjKJppK_IZeY8TUJg,"Starbucks Doubleshot Presents: The Art of the Craft, Chapter 2","In part two, Martijn Stiphout, owner of Ventana Surfboards, tells us what inspires him as he creates some of the world's most beautiful boards. Watch Chapter 1 of ...",https://i.ytimg.com/vi/KGZZsysMjn4/default.jpg,120,90,https://i.ytimg.com/vi/KGZZsysMjn4/mqdefault.jpg,320,180,https://i.ytimg.com/vi/KGZZsysMjn4/hqdefault.jpg,480,360,Starbucks Coffee,none,,,
guXMSd0fuq4,2015-11-05T19:16:17.000Z,UC3339WgBDKIcxTfywuSmG8w,Starbucks Employee Uses ASL To Connect With Customer || ViralHog,"Occurred November 3, 2015 - St. Augustine, FL A Starbucks employee uses ASL to connect with a customer via drive thru video screen. Now that is customer ...",https://i.ytimg.com/vi/guXMSd0fuq4/default.jpg,120,90,https://i.ytimg.com/vi/guXMSd0fuq4/mqdefault.jpg,320,180,https://i.ytimg.com/vi/guXMSd0fuq4/hqdefault.jpg,480,360,ViralHog,none,,,
5A4Tf3Tz2HQ,2015-03-18T01:00:00.000Z,UCV3Nm3T-XAgVhKH9jT0ViRg,Starbucks Barista: &#39;Want To Talk About Race?&#39;,"Starbucks CEO Howard Schultz wants to tackle the tough topic of race relations with a dialogue at your local Starbucks. Starting this week, Starbucks baristas ...",https://i.ytimg.com/vi/5A4Tf3Tz2HQ/default.jpg,120,90,https://i.ytimg.com/vi/5A4Tf3Tz2HQ/mqdefault.jpg,320,180,https://i.ytimg.com/vi/5A4Tf3Tz2HQ/hqdefault.jpg,480,360,AJ+,none,,,
jaHdzt2fN4M,2017-10-26T22:00:02.000Z,UC4gPKdabQVW2YyhCtO7JErw,STARBUCKS ZOMBIE FRAPPUCCINO TASTE TEST REVIEW!!! #ZombieFrappuccino,SUBSCRIBE HERE <U+25BB> https://www.youtube.com/user/mrfoamersimpson?su... the (almost) DAILY VLOG - ep 204. The STARBUCKS ZOMBIE FRAPPUCCINO ...,https://i.ytimg.com/vi/jaHdzt2fN4M/default.jpg,120,90,https://i.ytimg.com/vi/jaHdzt2fN4M/mqdefault.jpg,320,180,https://i.ytimg.com/vi/jaHdzt2fN4M/hqdefault.jpg,480,360,MR FOAMER SIMPSON,none,,,
79pqwmzG25I,2017-07-17T14:05:07.000Z,UCBMxQPhfM6nkhQ8vPfQhkCg,DIY Deep Fried Starbucks - Man Vs Fryer,Welcome back to the Deep Fried Madness! Subscribe to ThreadBanger HERE: http://bit.ly/12rVBFV MORE CONTENT!!!!!! Corinne's Personal Channel: ...,https://i.ytimg.com/vi/79pqwmzG25I/default.jpg,120,90,https://i.ytimg.com/vi/79pqwmzG25I/mqdefault.jpg,320,180,https://i.ytimg.com/vi/79pqwmzG25I/hqdefault.jpg,480,360,ThreadBanger,none,,,
5VownvT5Bow,2011-07-28T06:24:11.000Z,UCDcE_7wdjfErTth8LG6z2Wg,Starbucks Frappuccino Making Session - Foodtok,This was one of the lesson at Frappuccino School making Soy Green tea Frappuccino Blended Beverage. Foodtok attended the school :) http://foodtok.com/,https://i.ytimg.com/vi/5VownvT5Bow/default.jpg,120,90,https://i.ytimg.com/vi/5VownvT5Bow/mqdefault.jpg,320,180,https://i.ytimg.com/vi/5VownvT5Bow/hqdefault.jpg,480,360,FoodTok,none,,,
bI3wR3IEVM4,2019-03-08T00:33:36.000Z,UCH7nOJZZogYFhvHTqCKdiaQ,Trying NEW Starbucks Iced Cloud Drink I Caramel+Cinnamon,Hey guys I hope you guys enjoyed the video! Did you like Rabs Poncho? Well here it is: ...,https://i.ytimg.com/vi/bI3wR3IEVM4/default.jpg,120,90,https://i.ytimg.com/vi/bI3wR3IEVM4/mqdefault.jpg,320,180,https://i.ytimg.com/vi/bI3wR3IEVM4/hqdefault.jpg,480,360,Guam and Rab,none,,,
YkyTQP27H6s,2014-10-29T15:00:13.000Z,UCEJVWXwWH0As2PG7BSU1tqw,Coffee Frenemies | Starbucks and OUTtv,Even the top queens of RuPaul's Drag Race need caffeine. Who are your #coffeefrenemies? Adore Delano: @AdoreDelano Bianca Del Rio: ...,https://i.ytimg.com/vi/YkyTQP27H6s/default.jpg,120,90,https://i.ytimg.com/vi/YkyTQP27H6s/mqdefault.jpg,320,180,https://i.ytimg.com/vi/YkyTQP27H6s/hqdefault.jpg,480,360,OUTtv,none,,,
CQmVpHQ8ENs,2014-09-30T00:30:32.000Z,UCj4nCgtjKJppK_IZeY8TUJg,Meet Me at Starbucks,Filmed in 28 countries. In one day. http://meetme.starbucks.com.,https://i.ytimg.com/vi/CQmVpHQ8ENs/default.jpg,120,90,https://i.ytimg.com/vi/CQmVpHQ8ENs/mqdefault.jpg,320,180,https://i.ytimg.com/vi/CQmVpHQ8ENs/hqdefault.jpg,480,360,Starbucks Coffee,none,,,
MUTrJW-0xtc,2011-07-21T03:45:52.000Z,UCspkd6M2bV6ZfmZXdOTITjw,The Starbucks Rant Song,Now available on iTunes! http://itunes.apple.com/us/album/the-starbucks-rant-song/id467988933?i=467988937&uo=4 *there are a few minor expletives in this ...,https://i.ytimg.com/vi/MUTrJW-0xtc/default.jpg,120,90,https://i.ytimg.com/vi/MUTrJW-0xtc/mqdefault.jpg,320,180,https://i.ytimg.com/vi/MUTrJW-0xtc/hqdefault.jpg,480,360,chrissizle,none,,,
uRW-kFdhS2w,2018-10-03T16:47:29.000Z,UCJmSX7ghommK3pwMLGNUvPA,Seattle-Based Starbucks Locations Encountering Hypodermic Needles,Seattle Starbucks workers say that they encounter hypodermic needles nearly every day at the chain. They add the problem has grown worse under the chain's ...,https://i.ytimg.com/vi/uRW-kFdhS2w/default.jpg,120,90,https://i.ytimg.com/vi/uRW-kFdhS2w/mqdefault.jpg,320,180,https://i.ytimg.com/vi/uRW-kFdhS2w/hqdefault.jpg,480,360,Wochit News,none,,,
Xoox2saHCpA,2019-03-13T18:33:59.000Z,UCj4nCgtjKJppK_IZeY8TUJg,Starbucks Presents: To Be Human - Susan Tucker,"Fifty states. Our stores. Your stories. If you walk up to a perfect stranger sitting at a Starbucks, will they share their story? We've hit the road to find out.",https://i.ytimg.com/vi/Xoox2saHCpA/default.jpg,120,90,https://i.ytimg.com/vi/Xoox2saHCpA/mqdefault.jpg,320,180,https://i.ytimg.com/vi/Xoox2saHCpA/hqdefault.jpg,480,360,Starbucks Coffee,none,,,
hVH-oyUR-Sw,2018-07-22T13:00:06.000Z,UCeBnbqt4VRhotq2TQjkIi2A,Deer Queen&#39;s StarBUCKS | CuteCraft Minecraft SMP - Ep. 26,"Welcome to CuteCraft, a Minecraft modded multiplayer survival series on my channel! In today's episode, I build my own server shop called StarBUCKS. Get it?",https://i.ytimg.com/vi/hVH-oyUR-Sw/default.jpg,120,90,https://i.ytimg.com/vi/hVH-oyUR-Sw/mqdefault.jpg,320,180,https://i.ytimg.com/vi/hVH-oyUR-Sw/hqdefault.jpg,480,360,LaurenzSide,none,,,
#NAME?,2018-05-29T11:37:02.000Z,UC-SJ6nODDmufqBzPBwCvYvQ,Starbucks closing today for anti-bias training,Thousands of Starbucks stores will shut down this afternoon so employees can get racial bias training. Starbucks faced controversy after a manager called ...,https://i.ytimg.com/vi/-MlE5zlotp0/default.jpg,120,90,https://i.ytimg.com/vi/-MlE5zlotp0/mqdefault.jpg,320,180,https://i.ytimg.com/vi/-MlE5zlotp0/hqdefault.jpg,480,360,CBS This Morning,none,,,
at5murcIqvQ,2015-07-15T12:46:02.000Z,UCBu3BKgI8GlVEiv09CGMQ5A,Diy: potinho starbucks,L E I A <U+2665> Imagem/Logo do Starbucks: ...,https://i.ytimg.com/vi/at5murcIqvQ/default.jpg,120,90,https://i.ytimg.com/vi/at5murcIqvQ/mqdefault.jpg,320,180,https://i.ytimg.com/vi/at5murcIqvQ/hqdefault.jpg,480,360,Juliana Sartori,none,,,
dLkPH_B7tRo,2017-01-29T06:08:40.000Z,UCq_wEIbGSw6TJWIDHMEPmeQ,MY SUCCESSFUL STARBUCKS BARISTA INTERVIEW - NYC 2017,Spoiler alert* I get the job at the end of this video!!! LIVE. Well basically. Watch on to see how I got it and to follow along my training! Any requests and I'll make ...,https://i.ytimg.com/vi/dLkPH_B7tRo/default.jpg,120,90,https://i.ytimg.com/vi/dLkPH_B7tRo/mqdefault.jpg,320,180,https://i.ytimg.com/vi/dLkPH_B7tRo/hqdefault.jpg,480,360,Dazyet,none,,,
4SqOg6Zires,2018-04-05T20:50:27.000Z,UCIp9sEZiv36cDG7cEnrVU7Q,<U+2753>What’s WRONG with the STARBUCKS logo?,"In this video, I show you how a few pixels within a human-like logo design can change the look of the whole logo! Hope you enjoy this Starbucks Logo.",https://i.ytimg.com/vi/4SqOg6Zires/default.jpg,120,90,https://i.ytimg.com/vi/4SqOg6Zires/mqdefault.jpg,320,180,https://i.ytimg.com/vi/4SqOg6Zires/hqdefault.jpg,480,360,Will Paterson,none,,,
fog4C4Z9JEc,2018-04-16T13:13:01.000Z,UCj4nCgtjKJppK_IZeY8TUJg,A Follow-Up Message from Starbucks CEO in Philadelphia,"This is not who we are, and it's not who we are going to be.”",https://i.ytimg.com/vi/fog4C4Z9JEc/default.jpg,120,90,https://i.ytimg.com/vi/fog4C4Z9JEc/mqdefault.jpg,320,180,https://i.ytimg.com/vi/fog4C4Z9JEc/hqdefault.jpg,480,360,Starbucks Coffee,none,,,
1qK5GZp4NAk,2008-05-12T04:03:42.000Z,UCkTZAw_uTKfFTj2_giy35LQ,Starbucks Rap,"This is the original Starbucks Rap. The lyrics are below. If you're going to use this rap in your own video, please credit this one. Thanks! Inspired by the ...",https://i.ytimg.com/vi/1qK5GZp4NAk/default.jpg,120,90,https://i.ytimg.com/vi/1qK5GZp4NAk/mqdefault.jpg,320,180,https://i.ytimg.com/vi/1qK5GZp4NAk/hqdefault.jpg,480,360,The Way You Laugh,none,,,
igHVBgnaU4g,2013-09-01T03:09:51.000Z,UC-a8W5vVdA3nttEmQkp9Pxw,Starbucks Cups Song,"Starbucks baristas sing a parody of the cup song, and introduce Starbucks partnership with a new food line called La Boulange, and it's owner Pascal Rigo.",https://i.ytimg.com/vi/igHVBgnaU4g/default.jpg,120,90,https://i.ytimg.com/vi/igHVBgnaU4g/mqdefault.jpg,320,180,https://i.ytimg.com/vi/igHVBgnaU4g/hqdefault.jpg,480,360,Linda McDaniel,none,,,
